02:53:13.982580 IP 192.168.2.198.53233 > 192.168.2.1.domain: 22720+ A? www.yahoo.com. (31)
02:53:13.982612 IP 192.168.2.198.61947 > 192.168.2.1.domain: 9233+ AAAA? www.yahoo.com. (31)
02:53:14.018075 IP 192.168.2.1.domain > 192.168.2.198.53233: 22720 3/0/0 CNAME[|domain]
02:53:14.028385 IP 192.168.2.1.domain > 192.168.2.198.61947: 9233 2/0/0 CNAME[|domain]
02:53:14.029362 IP 192.168.2.198.50126 > 209.131.36.158.http: S 423781210:423781210(0) win 65535 <mss 1460,nop,wscale 3,nop,nop,timestamp 58205431 0,sackOK,eol>
02:53:14.049724 IP 209.131.36.158.http > 192.168.2.198.50126: S 3103838766:3103838766(0) ack 423781211 win 65535 <mss 1460,nop,wscale 1,nop,nop,timestamp 3294305114 58205431,sackOK,eol>
02:53:14.049856 IP 192.168.2.198.50126 > 209.131.36.158.http: . ack 1 win 65535 <nop,nop,timestamp 58205431 3294305114>
02:53:14.050364 IP 192.168.2.198.50126 > 209.131.36.158.http: P 1:419(418) ack 1 win 65535 <nop,nop,timestamp 58205431 3294305114>
02:53:14.125487 IP 209.131.36.158.http > 192.168.2.198.50126: . 1:1449(1448) ack 419 win 33304 <nop,nop,timestamp 3294305185 58205431>
02:53:14.131821 IP 209.131.36.158.http > 192.168.2.198.50126: . 1449:2897(1448) ack 419 win 33304 <nop,nop,timestamp 3294305185 58205431>
02:53:14.133572 IP 209.131.36.158.http > 192.168.2.198.50126: . 2897:4345(1448) ack 419 win 33304 <nop,nop,timestamp 3294305185 58205431>
02:53:14.133614 IP 192.168.2.198.50126 > 209.131.36.158.http: . ack 4345 win 65522 <nop,nop,timestamp 58205432 3294305185>
02:53:14.133793 IP 209.131.36.158.http > 192.168.2.198.50126: . 4345:5793(1448) ack 419 win 33304 <nop,nop,timestamp 3294305185 58205431>
02:53:14.162130 IP 209.131.36.158.http > 192.168.2.198.50126: . 5793:7241(1448) ack 419 win 33304 <nop,nop,timestamp 3294305214 58205432>
02:53:14.162135 IP 209.131.36.158.http > 192.168.2.198.50126: . 7241:8689(1448) ack 419 win 33304 <nop,nop,timestamp 3294305214 58205432>
02:53:14.162178 IP 192.168.2.198.50126 > 209.131.36.158.http: . ack 7241 win 65522 <nop,nop,timestamp 58205432 3294305185>
02:53:14.162350 IP 209.131.36.158.http > 192.168.2.198.50126: . 8689:10137(1448) ack 419 win 33304 <nop,nop,timestamp 3294305214 58205432>
02:53:14.162372 IP 192.168.2.198.50126 > 209.131.36.158.http: . ack 10137 win 65522 <nop,nop,timestamp 58205432 3294305214>
02:53:14.162595 IP 209.131.36.158.http > 192.168.2.198.50126: . 10137:11585(1448) ack 419 win 33304 <nop,nop,timestamp 3294305214 58205432>
02:53:14.184064 IP 209.131.36.158.http > 192.168.2.198.50126: . 11585:13033(1448) ack 419 win 33304 <nop,nop,timestamp 3294305243 58205432>
02:53:14.184176 IP 192.168.2.198.50126 > 209.131.36.158.http: . ack 13033 win 65535 <nop,nop,timestamp 58205432 3294305214>
02:53:14.188562 IP 209.131.36.158.http > 192.168.2.198.50126: . 13033:14481(1448) ack 419 win 33304 <nop,nop,timestamp 3294305243 58205432>
02:53:14.190352 IP 209.131.36.158.http > 192.168.2.198.50126: . 14481:15929(1448) ack 419 win 33304 <nop,nop,timestamp 3294305243 58205432>
02:53:14.190412 IP 192.168.2.198.50126 > 209.131.36.158.http: . ack 15929 win 65535 <nop,nop,timestamp 58205433 3294305243>
02:53:14.190579 IP 209.131.36.158.http > 192.168.2.198.50126: . 15929:17377(1448) ack 419 win 33304 <nop,nop,timestamp 3294305247 58205432>
02:53:14.190824 IP 209.131.36.158.http > 192.168.2.198.50126: . 17377:18825(1448) ack 419 win 33304 <nop,nop,timestamp 3294305247 58205432>
02:53:14.190944 IP 192.168.2.198.50126 > 209.131.36.158.http: . ack 18825 win 65535 <nop,nop,timestamp 58205433 3294305247>
02:53:14.191062 IP 209.131.36.158.http > 192.168.2.198.50126: . 18825:20273(1448) ack 419 win 33304 <nop,nop,timestamp 3294305247 58205432>
02:53:14.205660 IP 209.131.36.158.http > 192.168.2.198.50126: . 20273:21721(1448) ack 419 win 33304 <nop,nop,timestamp 3294305264 58205432>
02:53:14.205772 IP 192.168.2.198.50126 > 209.131.36.158.http: . ack 21721 win 65535 <nop,nop,timestamp 58205433 3294305247>
02:53:14.211276 IP 209.131.36.158.http > 192.168.2.198.50126: . 21721:23169(1448) ack 419 win 33304 <nop,nop,timestamp 3294305264 58205432>
02:53:14.211299 IP 192.168.2.198.50126 > 209.131.36.158.http: . ack 23169 win 65522 <nop,nop,timestamp 58205433 3294305264>
02:53:14.213712 IP 209.131.36.158.http > 192.168.2.198.50126: . 23169:24617(1448) ack 419 win 33304 <nop,nop,timestamp 3294305264 58205432>
02:53:14.213931 IP 209.131.36.158.http > 192.168.2.198.50126: . 24617:26065(1448) ack 419 win 33304 <nop,nop,timestamp 3294305270 58205433>
02:53:14.214100 IP 192.168.2.198.50126 > 209.131.36.158.http: . ack 26065 win 65535 <nop,nop,timestamp 58205433 3294305264>
02:53:14.215217 IP 209.131.36.158.http > 192.168.2.198.50126: . 26065:27513(1448) ack 419 win 33304 <nop,nop,timestamp 3294305270 58205433>
02:53:14.215455 IP 209.131.36.158.http > 192.168.2.198.50126: . 27513:28961(1448) ack 419 win 33304 <nop,nop,timestamp 3294305270 58205433>
02:53:14.215754 IP 192.168.2.198.50126 > 209.131.36.158.http: . ack 28961 win 65535 <nop,nop,timestamp 58205433 3294305270>
02:53:14.218478 IP 209.131.36.158.http > 192.168.2.198.50126: . 28961:30409(1448) ack 419 win 33304 <nop,nop,timestamp 3294305274 58205433>
02:53:14.218480 IP 209.131.36.158.http > 192.168.2.198.50126: . 30409:31857(1448) ack 419 win 33304 <nop,nop,timestamp 3294305274 58205433>
02:53:14.218482 IP 209.131.36.158.http > 192.168.2.198.50126: . 31857:33305(1448) ack 419 win 33304 <nop,nop,timestamp 3294305274 58205433>
02:53:14.218542 IP 192.168.2.198.50126 > 209.131.36.158.http: . ack 33305 win 65535 <nop,nop,timestamp 58205433 3294305274>
02:53:14.228856 IP 209.131.36.158.http > 192.168.2.198.50126: . 33305:34753(1448) ack 419 win 33304 <nop,nop,timestamp 3294305285 58205433>
02:53:14.233461 IP 209.131.36.158.http > 192.168.2.198.50126: FP 34753:35414(661) ack 419 win 33304 <nop,nop,timestamp 3294305285 58205433>
02:53:14.233497 IP 192.168.2.198.50126 > 209.131.36.158.http: . ack 35415 win 65535 <nop,nop,timestamp 58205433 3294305285>
02:53:14.234080 IP 192.168.2.198.50126 > 209.131.36.158.http: F 419:419(0) ack 35415 win 65535 <nop,nop,timestamp 58205433 3294305285>
02:53:14.257040 IP 209.131.36.158.http > 192.168.2.198.50126: . ack 420 win 33303 <nop,nop,timestamp 3294305315 58205433>
02:53:14.296066 IP 192.168.2.198.51381 > 192.168.2.1.domain: 45256+ A? l.yimg.com. (28)
02:53:14.296373 IP 192.168.2.198.64891 > 192.168.2.1.domain: 33872+ AAAA? l.yimg.com. (28)
02:53:14.325592 IP 192.168.2.1.domain > 192.168.2.198.51381: 45256 4/0/0 CNAME[|domain]
02:53:14.350577 IP 192.168.2.1.domain > 192.168.2.198.64891: 33872 2/0/0 CNAME[|domain]
02:53:14.352444 IP 192.168.2.198.50127 > 209.73.191.242.http: S 3238243296:3238243296(0) win 65535 <mss 1460,nop,wscale 3,nop,nop,timestamp 58205434 0,sackOK,eol>
02:53:14.352907 IP 192.168.2.198.50128 > 209.131.36.158.http: S 772194784:772194784(0) win 65535 <mss 1460,nop,wscale 3,nop,nop,timestamp 58205434 0,sackOK,eol>
02:53:14.372538 IP 209.73.191.242.http > 192.168.2.198.50127: S 425037723:425037723(0) ack 3238243297 win 5792 <mss 1460,sackOK,timestamp 3610590382 58205434,nop,wscale 8>
02:53:14.372598 IP 192.168.2.198.50127 > 209.73.191.242.http: . ack 1 win 65535 <nop,nop,timestamp 58205434 3610590382>
02:53:14.373107 IP 192.168.2.198.50127 > 209.73.191.242.http: P 1:341(340) ack 1 win 65535 <nop,nop,timestamp 58205434 3610590382>
02:53:14.377179 IP 209.131.36.158.http > 192.168.2.198.50128: S 3095524986:3095524986(0) ack 772194785 win 65535 <mss 1460,nop,wscale 1,nop,nop,timestamp 3335763907 58205434,sackOK,eol>
02:53:14.377300 IP 192.168.2.198.50128 > 209.131.36.158.http: . ack 1 win 65535 <nop,nop,timestamp 58205434 3335763907>
02:53:14.378000 IP 192.168.2.198.50128 > 209.131.36.158.http: P 1:455(454) ack 1 win 65535 <nop,nop,timestamp 58205434 3335763907>
02:53:14.397328 IP 209.73.191.242.http > 192.168.2.198.50127: . ack 341 win 27 <nop,nop,timestamp 3610590406 58205434>
02:53:14.398788 IP 209.73.191.242.http > 192.168.2.198.50127: P 1:363(362) ack 341 win 27 <nop,nop,timestamp 3610590406 58205434>
02:53:14.398808 IP 209.73.191.242.http > 192.168.2.198.50127: P 363:916(553) ack 341 win 27 <nop,nop,timestamp 3610590406 58205434>
02:53:14.398926 IP 192.168.2.198.50127 > 209.73.191.242.http: . ack 363 win 65535 <nop,nop,timestamp 58205435 3610590406>
02:53:14.399030 IP 192.168.2.198.50127 > 209.73.191.242.http: . ack 916 win 65535 <nop,nop,timestamp 58205435 3610590406>
02:53:14.404020 IP 209.131.36.158.http > 192.168.2.198.50128: P 1:908(907) ack 455 win 33304 <nop,nop,timestamp 3335763930 58205434>
02:53:14.404479 IP 192.168.2.198.50128 > 209.131.36.158.http: . ack 908 win 65535 <nop,nop,timestamp 58205435 3335763930>
02:53:14.404635 IP 209.131.36.158.http > 192.168.2.198.50128: F 908:908(0) ack 455 win 33304 <nop,nop,timestamp 3335763930 58205434>
02:53:14.404662 IP 192.168.2.198.50128 > 209.131.36.158.http: . ack 909 win 65535 <nop,nop,timestamp 58205435 3335763930>
02:53:14.405990 IP 192.168.2.198.50128 > 209.131.36.158.http: F 455:455(0) ack 909 win 65535 <nop,nop,timestamp 58205435 3335763930>
02:53:14.430883 IP 209.131.36.158.http > 192.168.2.198.50128: . ack 456 win 33303 <nop,nop,timestamp 3335763957 58205435>
02:53:14.439697 IP 192.168.2.198.61588 > 192.168.2.1.domain: 31678+ PTR? 1.2.168.192.in-addr.arpa. (42)
02:53:14.444167 IP 192.168.2.1.domain > 192.168.2.198.61588: 31678 NXDomain* 0/0/0 (42)
02:53:14.446750 IP 192.168.2.198.54500 > 192.168.2.1.domain: 46934+ PTR? 198.2.168.192.in-addr.arpa. (44)
02:53:14.451521 IP 192.168.2.1.domain > 192.168.2.198.54500: 46934 NXDomain* 0/0/0 (44)
02:53:14.753929 IP 192.168.2.198.50127 > 209.73.191.242.http: P 341:666(325) ack 916 win 65535 <nop,nop,timestamp 58205438 3610590406>
02:53:14.756690 IP 192.168.2.198.50129 > 209.73.191.242.http: S 4205352980:4205352980(0) win 65535 <mss 1460,nop,wscale 3,nop,nop,timestamp 58205438 0,sackOK,eol>
02:53:14.758367 IP 192.168.2.198.50130 > 209.73.191.242.http: S 1728393868:1728393868(0) win 65535 <mss 1460,nop,wscale 3,nop,nop,timestamp 58205438 0,sackOK,eol>
02:53:14.758911 IP 192.168.2.198.50131 > 209.73.191.242.http: S 3567821104:3567821104(0) win 65535 <mss 1460,nop,wscale 3,nop,nop,timestamp 58205438 0,sackOK,eol>
02:53:14.760174 IP 192.168.2.198.49520 > 192.168.2.1.domain: 5394+ AAAA? us.i1.yimg.com. (32)
02:53:14.760246 IP 192.168.2.198.50714 > 192.168.2.1.domain: 46084+ A? us.i1.yimg.com. (32)
02:53:14.774478 IP 209.73.191.242.http > 192.168.2.198.50127: P 916:1217(301) ack 666 win 31 <nop,nop,timestamp 3610590784 58205438>
02:53:14.774552 IP 192.168.2.198.50127 > 209.73.191.242.http: . ack 1217 win 65535 <nop,nop,timestamp 58205438 3610590784>
02:53:14.775870 IP 209.73.191.242.http > 192.168.2.198.50127: . 1217:2665(1448) ack 666 win 31 <nop,nop,timestamp 3610590784 58205438>
02:53:14.780848 IP 209.73.191.242.http > 192.168.2.198.50127: . 2665:4113(1448) ack 666 win 31 <nop,nop,timestamp 3610590784 58205438>
02:53:14.780887 IP 192.168.2.198.50127 > 209.73.191.242.http: . ack 4113 win 65522 <nop,nop,timestamp 58205438 3610590784>
02:53:14.781312 IP 209.73.191.242.http > 192.168.2.198.50130: S 3054931633:3054931633(0) ack 1728393869 win 5792 <mss 1460,sackOK,timestamp 437751432 58205438,nop,wscale 8>
02:53:14.781318 IP 209.73.191.242.http > 192.168.2.198.50129: S 1600869943:1600869943(0) ack 4205352981 win 5792 <mss 1460,sackOK,timestamp 2254890230 58205438,nop,wscale 8>
02:53:14.781324 IP 209.73.191.242.http > 192.168.2.198.50131: S 1326372723:1326372723(0) ack 3567821105 win 5792 <mss 1460,sackOK,timestamp 2250212528 58205438,nop,wscale 8>
02:53:14.781337 IP 192.168.2.198.50130 > 209.73.191.242.http: . ack 1 win 65535 <nop,nop,timestamp 58205438 437751432>
02:53:14.781363 IP 192.168.2.198.50129 > 209.73.191.242.http: . ack 1 win 65535 <nop,nop,timestamp 58205438 2254890230>
02:53:14.781399 IP 192.168.2.198.50131 > 209.73.191.242.http: . ack 1 win 65535 <nop,nop,timestamp 58205438 2250212528>
02:53:14.781660 IP 192.168.2.198.50129 > 209.73.191.242.http: P 1:324(323) ack 1 win 65535 <nop,nop,timestamp 58205438 2254890230>
02:53:14.782052 IP 192.168.2.198.50130 > 209.73.191.242.http: P 1:337(336) ack 1 win 65535 <nop,nop,timestamp 58205438 437751432>
02:53:14.782407 IP 192.168.2.198.50131 > 209.73.191.242.http: P 1:331(330) ack 1 win 65535 <nop,nop,timestamp 58205438 2250212528>
02:53:14.788420 IP 192.168.2.1.domain > 192.168.2.198.50714: 46084 4/0/0 CNAME[|domain]
02:53:14.795406 IP 209.73.191.242.http > 192.168.2.198.50127: P 4113:4605(492) ack 666 win 31 <nop,nop,timestamp 3610590804 58205438>
02:53:14.795460 IP 192.168.2.198.50127 > 209.73.191.242.http: . ack 4605 win 65535 <nop,nop,timestamp 58205439 3610590804>
02:53:14.795764 IP 192.168.2.198.50127 > 209.73.191.242.http: P 666:991(325) ack 4605 win 65535 <nop,nop,timestamp 58205439 3610590804>
02:53:14.806754 IP 209.73.191.242.http > 192.168.2.198.50130: . ack 337 win 27 <nop,nop,timestamp 437751457 58205438>
02:53:14.807031 IP 209.73.191.242.http > 192.168.2.198.50129: . ack 324 win 27 <nop,nop,timestamp 2254890255 58205438>
02:53:14.807266 IP 209.73.191.242.http > 192.168.2.198.50131: . ack 331 win 27 <nop,nop,timestamp 2250212553 58205438>
02:53:14.808238 IP 209.73.191.242.http > 192.168.2.198.50129: P 1:364(363) ack 324 win 27 <nop,nop,timestamp 2254890255 58205438>
02:53:14.808265 IP 192.168.2.198.50129 > 209.73.191.242.http: . ack 364 win 65535 <nop,nop,timestamp 58205439 2254890255>
02:53:14.808818 IP 209.73.191.242.http > 192.168.2.198.50129: . 364:1812(1448) ack 324 win 27 <nop,nop,timestamp 2254890255 58205438>
02:53:14.808827 IP 209.73.191.242.http > 192.168.2.198.50130: P 1:304(303) ack 337 win 27 <nop,nop,timestamp 437751458 58205438>
02:53:14.808860 IP 192.168.2.198.50130 > 209.73.191.242.http: . ack 304 win 65535 <nop,nop,timestamp 58205439 437751458>
02:53:14.808970 IP 209.73.191.242.http > 192.168.2.198.50130: . 304:1752(1448) ack 337 win 27 <nop,nop,timestamp 437751458 58205438>
02:53:14.808978 IP 209.73.191.242.http > 192.168.2.198.50131: P 1:302(301) ack 331 win 27 <nop,nop,timestamp 2250212553 58205438>
02:53:14.809442 IP 209.73.191.242.http > 192.168.2.198.50131: P 302:701(399) ack 331 win 27 <nop,nop,timestamp 2250212553 58205438>
02:53:14.809773 IP 192.168.2.198.50131 > 209.73.191.242.http: . ack 302 win 65535 <nop,nop,timestamp 58205439 2250212553>
02:53:14.809847 IP 192.168.2.198.50131 > 209.73.191.242.http: . ack 701 win 65535 <nop,nop,timestamp 58205439 2250212553>
02:53:14.810919 IP 192.168.2.198.50131 > 209.73.191.242.http: P 331:670(339) ack 701 win 65535 <nop,nop,timestamp 58205439 2250212553>
02:53:14.819451 IP 209.73.191.242.http > 192.168.2.198.50127: P 4605:4906(301) ack 991 win 36 <nop,nop,timestamp 3610590828 58205439>
02:53:14.819508 IP 192.168.2.198.50127 > 209.73.191.242.http: . ack 4906 win 65535 <nop,nop,timestamp 58205439 3610590828>
02:53:14.820459 IP 209.73.191.242.http > 192.168.2.198.50127: . 4906:6354(1448) ack 991 win 36 <nop,nop,timestamp 3610590828 58205439>
02:53:14.821499 IP 192.168.2.1.domain > 192.168.2.198.49520: 5394 2/0/0 CNAME[|domain]
02:53:14.823228 IP 192.168.2.198.50132 > 96.17.110.153.http: S 3605274955:3605274955(0) win 65535 <mss 1460,nop,wscale 3,nop,nop,timestamp 58205439 0,sackOK,eol>
02:53:14.825261 IP 209.73.191.242.http > 192.168.2.198.50127: . 6354:7802(1448) ack 991 win 36 <nop,nop,timestamp 3610590828 58205439>
02:53:14.825295 IP 192.168.2.198.50127 > 209.73.191.242.http: . ack 7802 win 65522 <nop,nop,timestamp 58205439 3610590828>
02:53:14.826387 IP 209.73.191.242.http > 192.168.2.198.50127: . 7802:9250(1448) ack 991 win 36 <nop,nop,timestamp 3610590828 58205439>
02:53:14.828784 IP 209.73.191.242.http > 192.168.2.198.50129: . 1812:3260(1448) ack 324 win 27 <nop,nop,timestamp 2254890276 58205439>
02:53:14.828882 IP 192.168.2.198.50129 > 209.73.191.242.http: . ack 3260 win 65522 <nop,nop,timestamp 58205439 2254890255>
02:53:14.836862 IP 209.73.191.242.http > 192.168.2.198.50129: . 3260:4708(1448) ack 324 win 27 <nop,nop,timestamp 2254890276 58205439>
02:53:14.837258 IP 209.73.191.242.http > 192.168.2.198.50130: . 1752:3200(1448) ack 337 win 27 <nop,nop,timestamp 437751482 58205439>
02:53:14.837286 IP 192.168.2.198.50130 > 209.73.191.242.http: . ack 3200 win 65522 <nop,nop,timestamp 58205439 437751458>
02:53:14.837377 IP 209.73.191.242.http > 192.168.2.198.50130: P 3200:4481(1281) ack 337 win 27 <nop,nop,timestamp 437751482 58205439>
02:53:14.837403 IP 192.168.2.198.50130 > 209.73.191.242.http: . ack 4481 win 65361 <nop,nop,timestamp 58205439 437751482>
02:53:14.837420 IP 209.73.191.242.http > 192.168.2.198.50131: P 701:1003(302) ack 670 win 31 <nop,nop,timestamp 2250212582 58205439>
02:53:14.837438 IP 192.168.2.198.50131 > 209.73.191.242.http: . ack 1003 win 65535 <nop,nop,timestamp 58205439 2250212582>
02:53:14.837992 IP 192.168.2.198.50130 > 209.73.191.242.http: P 337:660(323) ack 4481 win 65535 <nop,nop,timestamp 58205439 437751482>
02:53:14.838270 IP 209.73.191.242.http > 192.168.2.198.50131: . 1003:2451(1448) ack 670 win 31 <nop,nop,timestamp 2250212582 58205439>
02:53:14.838275 IP 209.73.191.242.http > 192.168.2.198.50131: P 2451:3216(765) ack 670 win 31 <nop,nop,timestamp 2250212582 58205439>
02:53:14.838307 IP 192.168.2.198.50131 > 209.73.191.242.http: . ack 3216 win 65388 <nop,nop,timestamp 58205439 2250212582>
02:53:14.838635 IP 192.168.2.198.50131 > 209.73.191.242.http: P 670:1000(330) ack 3216 win 65535 <nop,nop,timestamp 58205439 2250212582>
02:53:14.842815 IP 209.73.191.242.http > 192.168.2.198.50127: . 9250:10698(1448) ack 991 win 36 <nop,nop,timestamp 3610590848 58205439>
02:53:14.842853 IP 192.168.2.198.50127 > 209.73.191.242.http: . ack 10698 win 65522 <nop,nop,timestamp 58205439 3610590828>
02:53:14.843323 IP 209.73.191.242.http > 192.168.2.198.50127: P 10698:11702(1004) ack 991 win 36 <nop,nop,timestamp 3610590848 58205439>
02:53:14.843343 IP 192.168.2.198.50127 > 209.73.191.242.http: . ack 11702 win 65535 <nop,nop,timestamp 58205439 3610590848>
02:53:14.843473 IP 192.168.2.198.50127 > 209.73.191.242.http: P 991:1351(360) ack 11702 win 65535 <nop,nop,timestamp 58205439 3610590848>
02:53:14.843893 IP 96.17.110.153.http > 192.168.2.198.50132: S 1257191686:1257191686(0) ack 3605274956 win 5792 <mss 1460,sackOK,timestamp 3143519196 58205439,nop,wscale 1>
02:53:14.843921 IP 192.168.2.198.50132 > 96.17.110.153.http: . ack 1 win 65535 <nop,nop,timestamp 58205439 3143519196>
02:53:14.844149 IP 192.168.2.198.50132 > 96.17.110.153.http: P 1:339(338) ack 1 win 65535 <nop,nop,timestamp 58205439 3143519196>
02:53:14.851546 IP 209.73.191.242.http > 192.168.2.198.50129: . 4708:6156(1448) ack 324 win 27 <nop,nop,timestamp 2254890300 58205439>
02:53:14.851586 IP 192.168.2.198.50129 > 209.73.191.242.http: . ack 6156 win 65522 <nop,nop,timestamp 58205439 2254890276>
02:53:14.852081 IP 209.73.191.242.http > 192.168.2.198.50129: . 6156:7604(1448) ack 324 win 27 <nop,nop,timestamp 2254890300 58205439>
02:53:14.852238 IP 209.73.191.242.http > 192.168.2.198.50129: . 7604:9052(1448) ack 324 win 27 <nop,nop,timestamp 2254890300 58205439>
02:53:14.852258 IP 192.168.2.198.50129 > 209.73.191.242.http: . ack 9052 win 65522 <nop,nop,timestamp 58205439 2254890300>
02:53:14.862385 IP 209.73.191.242.http > 192.168.2.198.50130: P 4481:4783(302) ack 660 win 31 <nop,nop,timestamp 437751513 58205439>
02:53:14.862426 IP 192.168.2.198.50130 > 209.73.191.242.http: . ack 4783 win 65535 <nop,nop,timestamp 58205439 437751513>
02:53:14.862904 IP 209.73.191.242.http > 192.168.2.198.50130: P 4783:6036(1253) ack 660 win 31 <nop,nop,timestamp 437751513 58205439>
02:53:14.862924 IP 192.168.2.198.50130 > 209.73.191.242.http: . ack 6036 win 65535 <nop,nop,timestamp 58205439 437751513>
02:53:14.863108 IP 192.168.2.198.50130 > 209.73.191.242.http: P 660:993(333) ack 6036 win 65535 <nop,nop,timestamp 58205439 437751513>
02:53:14.864321 IP 209.73.191.242.http > 192.168.2.198.50131: P 3216:3517(301) ack 1000 win 36 <nop,nop,timestamp 2250212609 58205439>
02:53:14.864342 IP 192.168.2.198.50131 > 209.73.191.242.http: . ack 3517 win 65535 <nop,nop,timestamp 58205439 2250212609>
02:53:14.865676 IP 209.73.191.242.http > 192.168.2.198.50131: . 3517:4965(1448) ack 1000 win 36 <nop,nop,timestamp 2250212609 58205439>
02:53:14.866591 IP 209.73.191.242.http > 192.168.2.198.50131: . 4965:6413(1448) ack 1000 win 36 <nop,nop,timestamp 2250212609 58205439>
02:53:14.866618 IP 192.168.2.198.50131 > 209.73.191.242.http: . ack 6413 win 65522 <nop,nop,timestamp 58205439 2250212609>
02:53:14.867321 IP 209.73.191.242.http > 192.168.2.198.50131: . 6413:7861(1448) ack 1000 win 36 <nop,nop,timestamp 2250212609 58205439>
02:53:14.868174 IP 209.73.191.242.http > 192.168.2.198.50127: P 11702:12003(301) ack 1351 win 40 <nop,nop,timestamp 3610590875 58205439>
02:53:14.868201 IP 192.168.2.198.50127 > 209.73.191.242.http: . ack 12003 win 65535 <nop,nop,timestamp 58205439 3610590875>
02:53:14.868280 IP 209.73.191.242.http > 192.168.2.198.50127: . 12003:13451(1448) ack 1351 win 40 <nop,nop,timestamp 3610590875 58205439>
02:53:14.870576 IP 209.73.191.242.http > 192.168.2.198.50127: P 13451:13731(280) ack 1351 win 40 <nop,nop,timestamp 3610590875 58205439>
02:53:14.870604 IP 192.168.2.198.50127 > 209.73.191.242.http: . ack 13731 win 65535 <nop,nop,timestamp 58205439 3610590875>
02:53:14.870836 IP 192.168.2.198.50127 > 209.73.191.242.http: P 1351:1688(337) ack 13731 win 65535 <nop,nop,timestamp 58205439 3610590875>
02:53:14.870947 IP 96.17.110.153.http > 192.168.2.198.50132: . ack 339 win 3216 <nop,nop,timestamp 3143519223 58205439>
02:53:14.872885 IP 96.17.110.153.http > 192.168.2.198.50132: . 1:1449(1448) ack 339 win 3216 <nop,nop,timestamp 3143519223 58205439>
02:53:14.873185 IP 96.17.110.153.http > 192.168.2.198.50132: P 1449:1642(193) ack 339 win 3216 <nop,nop,timestamp 3143519223 58205439>
02:53:14.873546 IP 192.168.2.198.50132 > 96.17.110.153.http: . ack 1642 win 65497 <nop,nop,timestamp 58205439 3143519223>
02:53:14.875016 IP 209.73.191.242.http > 192.168.2.198.50129: . 9052:10500(1448) ack 324 win 27 <nop,nop,timestamp 2254890322 58205439>
02:53:14.877490 IP 209.73.191.242.http > 192.168.2.198.50129: . 10500:11948(1448) ack 324 win 27 <nop,nop,timestamp 2254890322 58205439>
02:53:14.877590 IP 192.168.2.198.50129 > 209.73.191.242.http: . ack 11948 win 65535 <nop,nop,timestamp 58205439 2254890322>
02:53:14.878030 IP 209.73.191.242.http > 192.168.2.198.50129: . 11948:13396(1448) ack 324 win 27 <nop,nop,timestamp 2254890322 58205439>
02:53:14.878386 IP 209.73.191.242.http > 192.168.2.198.50129: . 13396:14844(1448) ack 324 win 27 <nop,nop,timestamp 2254890326 58205439>
02:53:14.878445 IP 192.168.2.198.50129 > 209.73.191.242.http: . ack 14844 win 65535 <nop,nop,timestamp 58205439 2254890322>
02:53:14.878495 IP 209.73.191.242.http > 192.168.2.198.50129: . 14844:16292(1448) ack 324 win 27 <nop,nop,timestamp 2254890326 58205439>
02:53:14.879055 IP 209.73.191.242.http > 192.168.2.198.50129: . 16292:17740(1448) ack 324 win 27 <nop,nop,timestamp 2254890326 58205439>
02:53:14.879121 IP 192.168.2.198.50129 > 209.73.191.242.http: . ack 17740 win 65535 <nop,nop,timestamp 58205439 2254890326>
02:53:14.889993 IP 209.73.191.242.http > 192.168.2.198.50131: P 7861:9258(1397) ack 1000 win 36 <nop,nop,timestamp 2250212636 58205439>
02:53:14.890058 IP 192.168.2.198.50131 > 209.73.191.242.http: . ack 7861 win 65535 <nop,nop,timestamp 58205439 2250212609>
02:53:14.890152 IP 192.168.2.198.50131 > 209.73.191.242.http: . ack 9258 win 65528 <nop,nop,timestamp 58205439 2250212636>
02:53:14.890173 IP 209.73.191.242.http > 192.168.2.198.50130: P 6036:6335(299) ack 993 win 36 <nop,nop,timestamp 437751541 58205439>
02:53:14.890189 IP 209.73.191.242.http > 192.168.2.198.50130: P 6335:6378(43) ack 993 win 36 <nop,nop,timestamp 437751541 58205439>
02:53:14.890247 IP 192.168.2.198.50130 > 209.73.191.242.http: . ack 6335 win 65535 <nop,nop,timestamp 58205440 437751541>
02:53:14.890301 IP 192.168.2.198.50130 > 209.73.191.242.http: . ack 6378 win 65535 <nop,nop,timestamp 58205440 437751541>
02:53:14.890989 IP 192.168.2.198.50131 > 209.73.191.242.http: P 1000:1333(333) ack 9258 win 65535 <nop,nop,timestamp 58205440 2250212636>
02:53:14.892155 IP 192.168.2.198.50130 > 209.73.191.242.http: P 993:1326(333) ack 6378 win 65535 <nop,nop,timestamp 58205440 437751541>
02:53:14.894134 IP 209.73.191.242.http > 192.168.2.198.50127: P 13731:14032(301) ack 1688 win 44 <nop,nop,timestamp 3610590903 58205439>
02:53:14.894260 IP 192.168.2.198.50127 > 209.73.191.242.http: . ack 14032 win 65535 <nop,nop,timestamp 58205440 3610590903>
02:53:14.894525 IP 209.73.191.242.http > 192.168.2.198.50127: P 14032:14822(790) ack 1688 win 44 <nop,nop,timestamp 3610590903 58205439>
02:53:14.894554 IP 192.168.2.198.50127 > 209.73.191.242.http: . ack 14822 win 65535 <nop,nop,timestamp 58205440 3610590903>
02:53:14.895419 IP 192.168.2.198.50127 > 209.73.191.242.http: P 1688:2017(329) ack 14822 win 65535 <nop,nop,timestamp 58205440 3610590903>
02:53:14.911924 IP 209.73.191.242.http > 192.168.2.198.50129: . 17740:19188(1448) ack 324 win 27 <nop,nop,timestamp 2254890350 58205439>
02:53:14.915888 IP 209.73.191.242.http > 192.168.2.198.50129: . 19188:20636(1448) ack 324 win 27 <nop,nop,timestamp 2254890350 58205439>
02:53:14.916014 IP 192.168.2.198.50129 > 209.73.191.242.http: . ack 20636 win 65535 <nop,nop,timestamp 58205440 2254890350>
02:53:14.916242 IP 209.73.191.242.http > 192.168.2.198.50129: . 20636:22084(1448) ack 324 win 27 <nop,nop,timestamp 2254890350 58205439>
02:53:14.916267 IP 192.168.2.198.50129 > 209.73.191.242.http: . ack 22084 win 65522 <nop,nop,timestamp 58205440 2254890350>
02:53:14.917406 IP 209.73.191.242.http > 192.168.2.198.50129: . 22084:23532(1448) ack 324 win 27 <nop,nop,timestamp 2254890350 58205439>
02:53:14.920353 IP 209.73.191.242.http > 192.168.2.198.50129: . 23532:24980(1448) ack 324 win 27 <nop,nop,timestamp 2254890350 58205439>
02:53:14.920450 IP 192.168.2.198.50129 > 209.73.191.242.http: . ack 24980 win 65535 <nop,nop,timestamp 58205440 2254890350>
02:53:14.922198 IP 209.73.191.242.http > 192.168.2.198.50129: . 24980:26428(1448) ack 324 win 27 <nop,nop,timestamp 2254890350 58205439>
02:53:14.922202 IP 209.73.191.242.http > 192.168.2.198.50129: . 26428:27876(1448) ack 324 win 27 <nop,nop,timestamp 2254890350 58205439>
02:53:14.922204 IP 209.73.191.242.http > 192.168.2.198.50129: P 27876:27912(36) ack 324 win 27 <nop,nop,timestamp 2254890350 58205439>
02:53:14.922205 IP 209.73.191.242.http > 192.168.2.198.50131: P 9258:9561(303) ack 1333 win 40 <nop,nop,timestamp 2250212660 58205440>
02:53:14.922207 IP 209.73.191.242.http > 192.168.2.198.50131: . 9561:11009(1448) ack 1333 win 40 <nop,nop,timestamp 2250212660 58205440>
02:53:14.922208 IP 209.73.191.242.http > 192.168.2.198.50131: . 11009:12457(1448) ack 1333 win 40 <nop,nop,timestamp 2250212660 58205440>
02:53:14.922232 IP 192.168.2.198.50129 > 209.73.191.242.http: . ack 27912 win 65336 <nop,nop,timestamp 58205440 2254890350>
02:53:14.922332 IP 192.168.2.198.50131 > 209.73.191.242.http: . ack 9561 win 65535 <nop,nop,timestamp 58205440 2250212660>
02:53:14.922346 IP 209.73.191.242.http > 192.168.2.198.50131: . 12457:13905(1448) ack 1333 win 40 <nop,nop,timestamp 2250212660 58205440>
02:53:14.922349 IP 209.73.191.242.http > 192.168.2.198.50131: . 13905:15353(1448) ack 1333 win 40 <nop,nop,timestamp 2250212660 58205440>
02:53:14.922350 IP 209.73.191.242.http > 192.168.2.198.50130: P 6378:6680(302) ack 1326 win 40 <nop,nop,timestamp 437751569 58205440>
02:53:14.922375 IP 192.168.2.198.50130 > 209.73.191.242.http: . ack 6680 win 65535 <nop,nop,timestamp 58205440 437751569>
02:53:14.922436 IP 209.73.191.242.http > 192.168.2.198.50130: . 6680:8128(1448) ack 1326 win 40 <nop,nop,timestamp 437751569 58205440>
02:53:14.922508 IP 192.168.2.198.50129 > 209.73.191.242.http: P 324:648(324) ack 27912 win 65535 <nop,nop,timestamp 58205440 2254890350>
02:53:14.923111 IP 192.168.2.198.50131 > 209.73.191.242.http: . ack 15353 win 65453 <nop,nop,timestamp 58205440 2250212660>
02:53:14.925124 IP 209.73.191.242.http > 192.168.2.198.50130: . 8128:9576(1448) ack 1326 win 40 <nop,nop,timestamp 437751569 58205440>
02:53:14.925133 IP 209.73.191.242.http > 192.168.2.198.50130: . 9576:11024(1448) ack 1326 win 40 <nop,nop,timestamp 437751569 58205440>
02:53:14.925134 IP 209.73.191.242.http > 192.168.2.198.50127: P 14822:15066(244) ack 2017 win 48 <nop,nop,timestamp 3610590927 58205440>
02:53:14.925136 IP 209.73.191.242.http > 192.168.2.198.50127: P 15066:15109(43) ack 2017 win 48 <nop,nop,timestamp 3610590927 58205440>
02:53:14.925188 IP 192.168.2.198.50130 > 209.73.191.242.http: . ack 9576 win 65522 <nop,nop,timestamp 58205440 437751569>
02:53:14.925272 IP 192.168.2.198.50127 > 209.73.191.242.http: . ack 15066 win 65535 <nop,nop,timestamp 58205440 3610590927>
02:53:14.925283 IP 192.168.2.198.50127 > 209.73.191.242.http: . ack 15109 win 65535 <nop,nop,timestamp 58205440 3610590927>
02:53:14.925632 IP 192.168.2.198.50127 > 209.73.191.242.http: P 2017:2356(339) ack 15109 win 65535 <nop,nop,timestamp 58205440 3610590927>
02:53:14.946265 IP 209.73.191.242.http > 192.168.2.198.50130: . 11024:12472(1448) ack 1326 win 40 <nop,nop,timestamp 437751597 58205440>
02:53:14.946400 IP 192.168.2.198.50130 > 209.73.191.242.http: . ack 12472 win 65535 <nop,nop,timestamp 58205440 437751569>
02:53:14.949198 IP 209.73.191.242.http > 192.168.2.198.50131: P 15353:16119(766) ack 1333 win 40 <nop,nop,timestamp 2250212692 58205440>
02:53:14.949219 IP 192.168.2.198.50131 > 209.73.191.242.http: . ack 16119 win 65535 <nop,nop,timestamp 58205440 2250212692>
02:53:14.949395 IP 192.168.2.198.50131 > 209.73.191.242.http: P 1333:1669(336) ack 16119 win 65535 <nop,nop,timestamp 58205440 2250212692>
02:53:14.950375 IP 209.73.191.242.http > 192.168.2.198.50130: . 12472:13920(1448) ack 1326 win 40 <nop,nop,timestamp 437751597 58205440>
02:53:14.951201 IP 209.73.191.242.http > 192.168.2.198.50129: P 27912:28211(299) ack 648 win 31 <nop,nop,timestamp 2254890394 58205440>
02:53:14.951204 IP 209.73.191.242.http > 192.168.2.198.50129: P 28211:28619(408) ack 648 win 31 <nop,nop,timestamp 2254890394 58205440>
02:53:14.951225 IP 192.168.2.198.50129 > 209.73.191.242.http: . ack 28211 win 65535 <nop,nop,timestamp 58205440 2254890394>
02:53:14.951250 IP 192.168.2.198.50129 > 209.73.191.242.http: . ack 28619 win 65535 <nop,nop,timestamp 58205440 2254890394>
02:53:14.951305 IP 209.73.191.242.http > 192.168.2.198.50130: . 13920:15368(1448) ack 1326 win 40 <nop,nop,timestamp 437751601 58205440>
02:53:14.951427 IP 209.73.191.242.http > 192.168.2.198.50130: . 15368:16816(1448) ack 1326 win 40 <nop,nop,timestamp 437751601 58205440>
02:53:14.951437 IP 209.73.191.242.http > 192.168.2.198.50127: P 15109:15411(302) ack 2356 win 52 <nop,nop,timestamp 3610590958 58205440>
02:53:14.951466 IP 192.168.2.198.50127 > 209.73.191.242.http: . ack 15411 win 65535 <nop,nop,timestamp 58205440 3610590958>
02:53:14.951557 IP 192.168.2.198.50129 > 209.73.191.242.http: P 648:982(334) ack 28619 win 65535 <nop,nop,timestamp 58205440 2254890394>
02:53:14.951863 IP 192.168.2.198.50130 > 209.73.191.242.http: . ack 16816 win 65535 <nop,nop,timestamp 58205440 437751597>
02:53:14.951941 IP 209.73.191.242.http > 192.168.2.198.50130: . 16816:18264(1448) ack 1326 win 40 <nop,nop,timestamp 437751601 58205440>
02:53:14.953164 IP 209.73.191.242.http > 192.168.2.198.50127: . 15411:16859(1448) ack 2356 win 52 <nop,nop,timestamp 3610590959 58205440>
02:53:14.953850 IP 209.73.191.242.http > 192.168.2.198.50127: . 16859:18307(1448) ack 2356 win 52 <nop,nop,timestamp 3610590959 58205440>
02:53:14.953908 IP 192.168.2.198.50127 > 209.73.191.242.http: . ack 18307 win 65535 <nop,nop,timestamp 58205440 3610590959>
02:53:14.954564 IP 209.73.191.242.http > 192.168.2.198.50127: P 18307:19066(759) ack 2356 win 52 <nop,nop,timestamp 3610590959 58205440>
02:53:14.954784 IP 192.168.2.198.50127 > 209.73.191.242.http: . ack 19066 win 65535 <nop,nop,timestamp 58205440 3610590959>
02:53:14.965691 IP 209.73.191.242.http > 192.168.2.198.50130: . 18264:19712(1448) ack 1326 win 40 <nop,nop,timestamp 437751616 58205440>
02:53:14.965806 IP 192.168.2.198.50130 > 209.73.191.242.http: . ack 19712 win 65535 <nop,nop,timestamp 58205440 437751601>
02:53:14.966834 IP 209.73.191.242.http > 192.168.2.198.50130: . 19712:21160(1448) ack 1326 win 40 <nop,nop,timestamp 437751616 58205440>
02:53:14.966837 IP 209.73.191.242.http > 192.168.2.198.50130: . 21160:22608(1448) ack 1326 win 40 <nop,nop,timestamp 437751616 58205440>
02:53:14.966860 IP 192.168.2.198.50130 > 209.73.191.242.http: . ack 22608 win 65341 <nop,nop,timestamp 58205440 437751616>
02:53:14.969294 IP 192.168.2.198.50127 > 209.73.191.242.http: P 2356:2678(322) ack 19066 win 65535 <nop,nop,timestamp 58205440 3610590959>
02:53:14.972178 IP 209.73.191.242.http > 192.168.2.198.50131: P 16119:16421(302) ack 1669 win 44 <nop,nop,timestamp 2250212720 58205440>
02:53:14.972402 IP 192.168.2.198.50131 > 209.73.191.242.http: . ack 16421 win 65535 <nop,nop,timestamp 58205440 2250212720>
02:53:14.974753 IP 209.73.191.242.http > 192.168.2.198.50131: . 16421:17869(1448) ack 1669 win 44 <nop,nop,timestamp 2250212720 58205440>
02:53:14.975200 IP 209.73.191.242.http > 192.168.2.198.50131: . 17869:19317(1448) ack 1669 win 44 <nop,nop,timestamp 2250212720 58205440>
02:53:14.975266 IP 192.168.2.198.50131 > 209.73.191.242.http: . ack 19317 win 65535 <nop,nop,timestamp 58205440 2250212720>
02:53:14.975739 IP 209.73.191.242.http > 192.168.2.198.50131: P 19317:19931(614) ack 1669 win 44 <nop,nop,timestamp 2250212720 58205440>
02:53:14.975759 IP 192.168.2.198.50131 > 209.73.191.242.http: . ack 19931 win 65535 <nop,nop,timestamp 58205440 2250212720>
02:53:14.976913 IP 209.73.191.242.http > 192.168.2.198.50129: P 28619:28921(302) ack 982 win 36 <nop,nop,timestamp 2254890426 58205440>
02:53:14.976937 IP 192.168.2.198.50129 > 209.73.191.242.http: . ack 28921 win 65535 <nop,nop,timestamp 58205440 2254890426>
02:53:14.977449 IP 209.73.191.242.http > 192.168.2.198.50130: P 22608:23313(705) ack 1326 win 40 <nop,nop,timestamp 437751629 58205440>
02:53:14.977468 IP 192.168.2.198.50130 > 209.73.191.242.http: . ack 23313 win 65535 <nop,nop,timestamp 58205440 437751629>
02:53:14.977588 IP 192.168.2.198.50130 > 209.73.191.242.http: P 1326:1685(359) ack 23313 win 65535 <nop,nop,timestamp 58205440 437751629>
02:53:14.979532 IP 209.73.191.242.http > 192.168.2.198.50129: . 28921:30369(1448) ack 982 win 36 <nop,nop,timestamp 2254890426 58205440>
02:53:14.983094 IP 209.73.191.242.http > 192.168.2.198.50129: . 30369:31817(1448) ack 982 win 36 <nop,nop,timestamp 2254890426 58205440>
02:53:14.983201 IP 192.168.2.198.50129 > 209.73.191.242.http: . ack 31817 win 65535 <nop,nop,timestamp 58205440 2254890426>
02:53:14.983249 IP 209.73.191.242.http > 192.168.2.198.50129: . 31817:33265(1448) ack 982 win 36 <nop,nop,timestamp 2254890426 58205440>
02:53:14.983251 IP 209.73.191.242.http > 192.168.2.198.50129: . 33265:34713(1448) ack 982 win 36 <nop,nop,timestamp 2254890426 58205440>
02:53:14.983329 IP 192.168.2.198.50129 > 209.73.191.242.http: . ack 34713 win 65535 <nop,nop,timestamp 58205440 2254890426>
02:53:14.983398 IP 209.73.191.242.http > 192.168.2.198.50129: . 34713:36161(1448) ack 982 win 36 <nop,nop,timestamp 2254890426 58205440>
02:53:14.985670 IP 209.73.191.242.http > 192.168.2.198.50129: P 36161:37111(950) ack 982 win 36 <nop,nop,timestamp 2254890426 58205440>
02:53:14.985706 IP 192.168.2.198.50129 > 209.73.191.242.http: . ack 37111 win 65535 <nop,nop,timestamp 58205440 2254890426>
02:53:14.985893 IP 192.168.2.198.50129 > 209.73.191.242.http: P 982:1312(330) ack 37111 win 65535 <nop,nop,timestamp 58205440 2254890426>
02:53:14.993189 IP 209.73.191.242.http > 192.168.2.198.50127: P 19066:19427(361) ack 2678 win 57 <nop,nop,timestamp 3610591002 58205440>
02:53:14.993237 IP 192.168.2.198.50127 > 209.73.191.242.http: . ack 19427 win 65535 <nop,nop,timestamp 58205441 3610591002>
02:53:14.993724 IP 209.73.191.242.http > 192.168.2.198.50127: P 19427:20377(950) ack 2678 win 57 <nop,nop,timestamp 3610591002 58205440>
02:53:14.993743 IP 192.168.2.198.50127 > 209.73.191.242.http: . ack 20377 win 65535 <nop,nop,timestamp 58205441 3610591002>
02:53:15.000546 IP 209.73.191.242.http > 192.168.2.198.50130: P 23313:23614(301) ack 1685 win 44 <nop,nop,timestamp 437751653 58205440>
02:53:15.000587 IP 192.168.2.198.50130 > 209.73.191.242.http: . ack 23614 win 65535 <nop,nop,timestamp 58205441 437751653>
02:53:15.001006 IP 209.73.191.242.http > 192.168.2.198.50130: P 23614:23971(357) ack 1685 win 44 <nop,nop,timestamp 437751653 58205440>
02:53:15.001032 IP 192.168.2.198.50130 > 209.73.191.242.http: . ack 23971 win 65535 <nop,nop,timestamp 58205441 437751653>
02:53:15.001436 IP 192.168.2.198.50130 > 209.73.191.242.http: P 1685:2013(328) ack 23971 win 65535 <nop,nop,timestamp 58205441 437751653>
02:53:15.008721 IP 209.73.191.242.http > 192.168.2.198.50129: P 37111:37412(301) ack 1312 win 40 <nop,nop,timestamp 2254890458 58205440>
02:53:15.008780 IP 192.168.2.198.50129 > 209.73.191.242.http: . ack 37412 win 65535 <nop,nop,timestamp 58205441 2254890458>
02:53:15.010237 IP 209.73.191.242.http > 192.168.2.198.50129: P 37412:38572(1160) ack 1312 win 40 <nop,nop,timestamp 2254890458 58205440>
02:53:15.010280 IP 192.168.2.198.50129 > 209.73.191.242.http: . ack 38572 win 65535 <nop,nop,timestamp 58205441 2254890458>
02:53:15.011639 IP 192.168.2.198.50129 > 209.73.191.242.http: P 1312:1632(320) ack 38572 win 65535 <nop,nop,timestamp 58205441 2254890458>
02:53:15.025455 IP 209.73.191.242.http > 192.168.2.198.50130: P 23971:24291(320) ack 2013 win 48 <nop,nop,timestamp 437751677 58205441>
02:53:15.025508 IP 192.168.2.198.50130 > 209.73.191.242.http: . ack 24291 win 65535 <nop,nop,timestamp 58205441 437751677>
02:53:15.027260 IP 209.73.191.242.http > 192.168.2.198.50130: . 24291:25739(1448) ack 2013 win 48 <nop,nop,timestamp 437751677 58205441>
02:53:15.027978 IP 209.73.191.242.http > 192.168.2.198.50130: . 25739:27187(1448) ack 2013 win 48 <nop,nop,timestamp 437751677 58205441>
02:53:15.028050 IP 192.168.2.198.50130 > 209.73.191.242.http: . ack 27187 win 65535 <nop,nop,timestamp 58205441 437751677>
02:53:15.028554 IP 209.73.191.242.http > 192.168.2.198.50130: . 27187:28635(1448) ack 2013 win 48 <nop,nop,timestamp 437751677 58205441>
02:53:15.034503 IP 209.73.191.242.http > 192.168.2.198.50130: . 28635:30083(1448) ack 2013 win 48 <nop,nop,timestamp 437751677 58205441>
02:53:15.034695 IP 192.168.2.198.50130 > 209.73.191.242.http: . ack 30083 win 65535 <nop,nop,timestamp 58205441 437751677>
02:53:15.035067 IP 209.73.191.242.http > 192.168.2.198.50130: P 30083:30437(354) ack 2013 win 48 <nop,nop,timestamp 437751677 58205441>
02:53:15.035111 IP 192.168.2.198.50130 > 209.73.191.242.http: . ack 30437 win 65535 <nop,nop,timestamp 58205441 437751677>
02:53:15.035687 IP 209.73.191.242.http > 192.168.2.198.50129: P 38572:38872(300) ack 1632 win 44 <nop,nop,timestamp 2254890482 58205441>
02:53:15.035737 IP 192.168.2.198.50129 > 209.73.191.242.http: . ack 38872 win 65535 <nop,nop,timestamp 58205441 2254890482>
02:53:15.035824 IP 209.73.191.242.http > 192.168.2.198.50129: . 38872:40320(1448) ack 1632 win 44 <nop,nop,timestamp 2254890482 58205441>
02:53:15.035869 IP 209.73.191.242.http > 192.168.2.198.50129: P 40320:40746(426) ack 1632 win 44 <nop,nop,timestamp 2254890482 58205441>
02:53:15.036096 IP 192.168.2.198.50129 > 209.73.191.242.http: . ack 40746 win 65431 <nop,nop,timestamp 58205441 2254890482>
02:53:15.036526 IP 192.168.2.198.50129 > 209.73.191.242.http: P 1632:1989(357) ack 40746 win 65535 <nop,nop,timestamp 58205441 2254890482>
02:53:15.057617 IP 209.73.191.242.http > 192.168.2.198.50129: P 40746:41048(302) ack 1989 win 48 <nop,nop,timestamp 2254890506 58205441>
02:53:15.057665 IP 192.168.2.198.50129 > 209.73.191.242.http: . ack 41048 win 65535 <nop,nop,timestamp 58205441 2254890506>
02:53:15.058140 IP 209.73.191.242.http > 192.168.2.198.50129: P 41048:41973(925) ack 1989 win 48 <nop,nop,timestamp 2254890506 58205441>
