21:59:18.848188 IP 209.211.201.129.http > 192.168.1.200.51923: S 757928739:757928739(0) ack 2742319753 win 5792 <mss 1460,sackOK,timestamp 2922253895 565126738,nop,wscale 0>
21:59:18.848241 IP 192.168.1.200.51923 > 209.211.201.129.http: R 2742319753:2742319753(0) win 0
21:59:19.651709 IP 209.211.201.129.http > 192.168.1.200.51925: S 756149655:756149655(0) ack 2284752950 win 5792 <mss 1460,sackOK,timestamp 2922254695 565126738,nop,wscale 0>
21:59:19.651775 IP 192.168.1.200.51925 > 209.211.201.129.http: R 2284752950:2284752950(0) win 0
21:59:19.816384 IP 192.168.1.200.51590 > 192.168.1.1.domain: 62265+ PTR? 200.1.168.192.in-addr.arpa. (44)
21:59:19.822889 IP 192.168.1.1.domain > 192.168.1.200.51590: 62265 NXDomain* 0/0/0 (44)
21:59:20.832423 IP 192.168.1.200.51591 > 192.168.1.1.domain: 27483+ PTR? 1.1.168.192.in-addr.arpa. (42)
21:59:20.836418 IP 192.168.1.1.domain > 192.168.1.200.51591: 27483 NXDomain* 0/0/0 (42)
21:59:21.030986 IP 192.168.1.200.ipp > 192.168.1.255.ipp: UDP, length 191
21:59:21.870344 IP 192.168.1.200.51592 > 192.168.1.1.domain: 39171+ PTR? 255.1.168.192.in-addr.arpa. (44)
21:59:21.874402 IP 192.168.1.1.domain > 192.168.1.200.51592: 39171 NXDomain* 0/0/0 (44)
21:59:24.788105 IP 209.237.233.179.http > 192.168.1.200.51767: R 3433562478:3433562478(0) ack 2656886750 win 4290
21:59:26.392483 IP 192.168.1.200.51943 > 204.253.133.10.http: S 1740769198:1740769198(0) win 65535 <mss 1460,nop,wscale 1,nop,nop,timestamp 565127271 0,sackOK,eol>
21:59:26.488937 IP 204.253.133.10.http > 192.168.1.200.51943: S 4261342271:4261342271(0) ack 1740769199 win 5792 <mss 1200,sackOK,timestamp 3390283666 565127271,nop,wscale 2>
21:59:26.489019 IP 192.168.1.200.51943 > 204.253.133.10.http: . ack 1 win 33264 <nop,nop,timestamp 565127272 3390283666>
21:59:26.489630 IP 192.168.1.200.51943 > 204.253.133.10.http: P 1:386(385) ack 1 win 33264 <nop,nop,timestamp 565127272 3390283666>
21:59:26.584925 IP 204.253.133.10.http > 192.168.1.200.51943: . ack 386 win 1716 <nop,nop,timestamp 3390283762 565127272>
21:59:26.637148 IP 204.253.133.10.http > 192.168.1.200.51943: . 1:1189(1188) ack 386 win 1716 <nop,nop,timestamp 3390283814 565127272>
21:59:26.638362 IP 204.253.133.10.http > 192.168.1.200.51943: . 1189:2377(1188) ack 386 win 1716 <nop,nop,timestamp 3390283814 565127272>
21:59:26.638402 IP 192.168.1.200.51943 > 204.253.133.10.http: . ack 2377 win 32670 <nop,nop,timestamp 565127273 3390283814>
21:59:26.734983 IP 204.253.133.10.http > 192.168.1.200.51943: . 2377:3565(1188) ack 386 win 1716 <nop,nop,timestamp 3390283911 565127273>
21:59:26.735108 IP 192.168.1.200.51943 > 204.253.133.10.http: . ack 3565 win 33264 <nop,nop,timestamp 565127274 3390283911>
21:59:26.735760 IP 204.253.133.10.http > 192.168.1.200.51943: . 3565:4753(1188) ack 386 win 1716 <nop,nop,timestamp 3390283911 565127273>
21:59:26.735794 IP 192.168.1.200.51943 > 204.253.133.10.http: . ack 4753 win 32670 <nop,nop,timestamp 565127274 3390283911>
21:59:26.736222 IP 204.253.133.10.http > 192.168.1.200.51943: . 4753:5941(1188) ack 386 win 1716 <nop,nop,timestamp 3390283911 565127273>
21:59:26.736289 IP 192.168.1.200.51943 > 204.253.133.10.http: . ack 5941 win 33264 <nop,nop,timestamp 565127274 3390283911>
21:59:26.830117 IP 204.253.133.10.http > 192.168.1.200.51943: . 5941:7129(1188) ack 386 win 1716 <nop,nop,timestamp 3390284008 565127274>
21:59:26.830181 IP 192.168.1.200.51943 > 204.253.133.10.http: . ack 7129 win 32670 <nop,nop,timestamp 565127275 3390284008>
21:59:26.831196 IP 204.253.133.10.http > 192.168.1.200.51943: . 7129:8317(1188) ack 386 win 1716 <nop,nop,timestamp 3390284008 565127274>
21:59:26.831279 IP 192.168.1.200.51943 > 204.253.133.10.http: . ack 8317 win 33264 <nop,nop,timestamp 565127275 3390284008>
21:59:26.832317 IP 204.253.133.10.http > 192.168.1.200.51943: . 8317:9505(1188) ack 386 win 1716 <nop,nop,timestamp 3390284008 565127274>
21:59:26.832420 IP 204.253.133.10.http > 192.168.1.200.51943: . 9505:10693(1188) ack 386 win 1716 <nop,nop,timestamp 3390284008 565127274>
21:59:26.832519 IP 192.168.1.200.51943 > 204.253.133.10.http: . ack 10693 win 33264 <nop,nop,timestamp 565127275 3390284008>
21:59:26.833481 IP 204.253.133.10.http > 192.168.1.200.51943: P 10693:11881(1188) ack 386 win 1716 <nop,nop,timestamp 3390284008 565127274>
21:59:26.833515 IP 192.168.1.200.51943 > 204.253.133.10.http: . ack 11881 win 32670 <nop,nop,timestamp 565127275 3390284008>
21:59:26.927994 IP 204.253.133.10.http > 192.168.1.200.51943: . 11881:13069(1188) ack 386 win 1716 <nop,nop,timestamp 3390284103 565127275>
21:59:26.928131 IP 192.168.1.200.51943 > 204.253.133.10.http: . ack 13069 win 33264 <nop,nop,timestamp 565127276 3390284103>
21:59:26.929599 IP 204.253.133.10.http > 192.168.1.200.51943: . 13069:14257(1188) ack 386 win 1716 <nop,nop,timestamp 3390284103 565127275>
21:59:26.929934 IP 204.253.133.10.http > 192.168.1.200.51943: . 14257:15445(1188) ack 386 win 1716 <nop,nop,timestamp 3390284104 565127275>
21:59:26.930324 IP 204.253.133.10.http > 192.168.1.200.51943: . 15445:16633(1188) ack 386 win 1716 <nop,nop,timestamp 3390284104 565127275>
21:59:26.931106 IP 192.168.1.200.51943 > 204.253.133.10.http: . ack 16633 win 33264 <nop,nop,timestamp 565127276 3390284103>
21:59:26.932162 IP 204.253.133.10.http > 192.168.1.200.51943: P 16633:17821(1188) ack 386 win 1716 <nop,nop,timestamp 3390284107 565127275>
21:59:26.932203 IP 192.168.1.200.51943 > 204.253.133.10.http: . ack 17821 win 32670 <nop,nop,timestamp 565127276 3390284107>
21:59:26.932730 IP 204.253.133.10.http > 192.168.1.200.51943: . 17821:19009(1188) ack 386 win 1716 <nop,nop,timestamp 3390284107 565127275>
21:59:26.932795 IP 192.168.1.200.51943 > 204.253.133.10.http: . ack 19009 win 33264 <nop,nop,timestamp 565127276 3390284107>
21:59:26.933134 IP 204.253.133.10.http > 192.168.1.200.51943: P 20066:20071(5) ack 386 win 1716 <nop,nop,timestamp 3390284107 565127275>
21:59:26.933190 IP 192.168.1.200.51943 > 204.253.133.10.http: . ack 19009 win 33264 <nop,nop,timestamp 565127276 3390284107,nop,nop,sack 1 {20066:20071}>
21:59:26.933611 IP 204.253.133.10.http > 192.168.1.200.51943: P 19009:20066(1057) ack 386 win 1716 <nop,nop,timestamp 3390284107 565127275>
21:59:26.933643 IP 192.168.1.200.51943 > 204.253.133.10.http: . ack 20071 win 32733 <nop,nop,timestamp 565127276 3390284107>
21:59:26.960635 IP 192.168.1.200.51944 > 204.253.132.111.http: S 4029041451:4029041451(0) win 65535 <mss 1460,nop,wscale 1,nop,nop,timestamp 565127276 0,sackOK,eol>
21:59:27.049586 IP 204.253.132.111.http > 192.168.1.200.51944: S 783347939:783347939(0) ack 4029041452 win 5792 <mss 1200,sackOK,timestamp 3392035316 565127276,nop,wscale 7>
21:59:27.049646 IP 192.168.1.200.51944 > 204.253.132.111.http: . ack 1 win 33264 <nop,nop,timestamp 565127277 3392035316>
21:59:27.049943 IP 192.168.1.200.51944 > 204.253.132.111.http: P 1:365(364) ack 1 win 33264 <nop,nop,timestamp 565127277 3392035316>
21:59:27.139942 IP 204.253.132.111.http > 192.168.1.200.51944: . ack 365 win 54 <nop,nop,timestamp 3392035407 565127277>
21:59:27.144263 IP 204.253.132.111.http > 192.168.1.200.51944: F 738:738(0) ack 365 win 54 <nop,nop,timestamp 3392035411 565127277>
21:59:27.144313 IP 192.168.1.200.51944 > 204.253.132.111.http: . ack 1 win 33264 <nop,nop,timestamp 565127278 3392035407>
21:59:27.144919 IP 204.253.132.111.http > 192.168.1.200.51944: P 1:738(737) ack 365 win 54 <nop,nop,timestamp 3392035411 565127277>
21:59:27.144956 IP 192.168.1.200.51944 > 204.253.132.111.http: . ack 739 win 32895 <nop,nop,timestamp 565127278 3392035411>
21:59:27.145395 IP 192.168.1.200.51944 > 204.253.132.111.http: F 365:365(0) ack 739 win 33264 <nop,nop,timestamp 565127278 3392035411>
21:59:27.150088 IP 192.168.1.200.51945 > 204.253.132.111.http: S 1398347217:1398347217(0) win 65535 <mss 1460,nop,wscale 1,nop,nop,timestamp 565127278 0,sackOK,eol>
21:59:27.234967 IP 204.253.132.111.http > 192.168.1.200.51944: . ack 366 win 54 <nop,nop,timestamp 3392035502 565127278>
21:59:27.245962 IP 204.253.132.111.http > 192.168.1.200.51945: S 1690370632:1690370632(0) ack 1398347218 win 5792 <mss 1200,sackOK,timestamp 3392035512 565127278,nop,wscale 7>
21:59:27.246006 IP 192.168.1.200.51945 > 204.253.132.111.http: . ack 1 win 33264 <nop,nop,timestamp 565127279 3392035512>
21:59:27.246393 IP 192.168.1.200.51945 > 204.253.132.111.http: P 1:427(426) ack 1 win 33264 <nop,nop,timestamp 565127279 3392035512>
21:59:27.348696 IP 204.253.132.111.http > 192.168.1.200.51945: . ack 427 win 54 <nop,nop,timestamp 3392035612 565127279>
21:59:27.355485 IP 204.253.132.111.http > 192.168.1.200.51945: P 1:816(815) ack 427 win 54 <nop,nop,timestamp 3392035619 565127279>
21:59:27.355541 IP 192.168.1.200.51945 > 204.253.132.111.http: . ack 816 win 32856 <nop,nop,timestamp 565127280 3392035619>
21:59:27.356111 IP 192.168.1.200.51945 > 204.253.132.111.http: F 427:427(0) ack 816 win 33264 <nop,nop,timestamp 565127280 3392035619>
21:59:27.356483 IP 204.253.132.111.http > 192.168.1.200.51945: F 816:816(0) ack 427 win 54 <nop,nop,timestamp 3392035619 565127279>
21:59:27.356516 IP 192.168.1.200.51945 > 204.253.132.111.http: F 427:427(0) ack 817 win 33264 <nop,nop,timestamp 565127280 3392035619>
21:59:27.453987 IP 204.253.132.111.http > 192.168.1.200.51945: . ack 428 win 54 <nop,nop,timestamp 3392035720 565127280>
21:59:30.860730 IP 192.168.1.200.51946 > 66.151.152.125.http: S 4034218570:4034218570(0) win 65535 <mss 1460,nop,wscale 1,nop,nop,timestamp 565127315 0,sackOK,eol>
21:59:30.885547 IP 66.151.152.125.http > 192.168.1.200.51946: S 4140929559:4140929559(0) ack 4034218571 win 4380 <mss 1460>
21:59:30.885608 IP 192.168.1.200.51946 > 66.151.152.125.http: . ack 1 win 65535
21:59:30.886022 IP 192.168.1.200.51946 > 66.151.152.125.http: . 1:1461(1460) ack 1 win 65535
21:59:30.913148 IP 66.151.152.125.http > 192.168.1.200.51946: . ack 1461 win 4380
21:59:30.913290 IP 192.168.1.200.51946 > 66.151.152.125.http: P 1461:1956(495) ack 1 win 65535
21:59:30.945154 IP 66.151.152.125.http > 192.168.1.200.51946: . ack 1956 win 4380
21:59:30.948555 IP 66.151.152.125.http > 192.168.1.200.51946: P 1:569(568) ack 1956 win 62780
21:59:30.948609 IP 192.168.1.200.51946 > 66.151.152.125.http: . ack 569 win 65132
21:59:30.964149 IP 192.168.1.200.51593 > 192.168.1.1.domain: 38245+ A? www.apple.com. (31)
21:59:30.964671 IP 192.168.1.200.51594 > 192.168.1.1.domain: 20828+ AAAA? www.apple.com. (31)
21:59:30.986762 IP 192.168.1.1.domain > 192.168.1.200.51593: 38245 2/0/0 CNAME[|domain]
21:59:30.990281 IP 192.168.1.1.domain > 192.168.1.200.51594: 20828 1/0/0 CNAME[|domain]
21:59:30.990845 IP 192.168.1.200.51947 > 17.112.152.32.http: S 536847208:536847208(0) win 65535 <mss 1460,nop,wscale 1,nop,nop,timestamp 565127317 0,sackOK,eol>
21:59:31.013191 IP 17.112.152.32.http > 192.168.1.200.51947: S 2594316720:2594316720(0) ack 536847209 win 8190 <mss 1380>
21:59:31.013257 IP 192.168.1.200.51947 > 17.112.152.32.http: . ack 1 win 65535
21:59:31.015153 IP 192.168.1.200.51947 > 17.112.152.32.http: . 1:1381(1380) ack 1 win 65535
21:59:31.184727 IP 209.237.233.179.http > 192.168.1.200.51761: R 3527082458:3527082458(0) ack 443674484 win 4769
21:59:31.251654 IP 17.112.152.32.http > 192.168.1.200.51947: . ack 1381 win 8190
21:59:31.251720 IP 192.168.1.200.51947 > 17.112.152.32.http: P 1381:1919(538) ack 1 win 65535
21:59:31.276021 IP 17.112.152.32.http > 192.168.1.200.51947: . ack 1919 win 14466
21:59:31.276461 IP 17.112.152.32.http > 192.168.1.200.51947: P 1:158(157) ack 1919 win 16384
21:59:31.276496 IP 192.168.1.200.51947 > 17.112.152.32.http: . ack 158 win 65535
21:59:31.276896 IP 192.168.1.200.51947 > 17.112.152.32.http: F 1919:1919(0) ack 158 win 65535
21:59:31.303002 IP 17.112.152.32.http > 192.168.1.200.51947: F 158:158(0) ack 1920 win 8190
21:59:31.317142 IP 192.168.1.200.51764 > 134.4.25.122.http: F 4288876899:4288876899(0) ack 4114138967 win 65535 <nop,nop,timestamp 565127320 1090757514>
21:59:31.317575 IP 192.168.1.200.51785 > 64.86.94.17.http: F 3259480872:3259480872(0) ack 499777526 win 33304 <nop,nop,timestamp 565127320 2920473695>
21:59:31.319349 IP 192.168.1.200.51771 > 209.85.169.99.http: F 14636218:14636218(0) ack 1877340036 win 33323 <nop,nop,timestamp 565127320 1610530649>
21:59:31.319635 IP 192.168.1.200.51772 > 208.69.40.169.http: F 3360547083:3360547083(0) ack 2763838222 win 33304 <nop,nop,timestamp 565127320 591347581>
21:59:31.319870 IP 192.168.1.200.51787 > 208.70.25.207.http: F 2271154197:2271154197(0) ack 208787857 win 33304 <nop,nop,timestamp 565127320 279518739>
21:59:31.320097 IP 192.168.1.200.51773 > 12.190.48.152.http: F 884536738:884536738(0) ack 500364210 win 33304 <nop,nop,timestamp 565127320 198147880>
21:59:31.320327 IP 192.168.1.200.51750 > 208.65.153.253.http: F 2882228018:2882228018(0) ack 441684325 win 65535
21:59:31.337916 IP 64.86.94.17.http > 192.168.1.200.51785: F 1:1(0) ack 1 win 7504 <nop,nop,timestamp 2920774762 565127320>
21:59:31.341978 IP 12.190.48.152.http > 192.168.1.200.51773: F 1:1(0) ack 1 win 6432 <nop,nop,timestamp 198456246 565127320>
21:59:31.348038 IP 208.70.25.207.http > 192.168.1.200.51787: R 208787857:208787857(0) win 0
21:59:31.348223 IP 208.65.153.253.http > 192.168.1.200.51750: R 441684325:441684325(0) win 8201
21:59:31.353471 IP 134.4.25.122.http > 192.168.1.200.51764: . ack 1 win 24624 <nop,nop,timestamp 1090786881 565127320>
21:59:31.353765 IP 208.69.40.169.http > 192.168.1.200.51772: R 2763838222:2763838222(0) win 0
21:59:31.362255 IP 209.85.169.99.http > 192.168.1.200.51771: R 1877340036:1877340036(0) win 0
21:59:31.589606 IP 64.86.94.17.http > 192.168.1.200.51785: F 1:1(0) ack 1 win 7504 <nop,nop,timestamp 2920775013 565127320>
21:59:31.589748 IP 192.168.1.200.51785 > 64.86.94.17.http: . ack 2 win 33304 <nop,nop,timestamp 565127323 2920775013>
21:59:31.907629 IP 12.190.48.152.http > 192.168.1.200.51773: F 1:1(0) ack 1 win 6432 <nop,nop,timestamp 198456814 565127320>
21:59:31.907695 IP 192.168.1.200.51773 > 12.190.48.152.http: . ack 2 win 33304 <nop,nop,timestamp 565127326 198456814>
21:59:31.931026 IP 204.253.133.10.http > 192.168.1.200.51943: F 20071:20071(0) ack 386 win 1716 <nop,nop,timestamp 3390289109 565127276>
21:59:31.931092 IP 192.168.1.200.51943 > 204.253.133.10.http: . ack 20072 win 33264 <nop,nop,timestamp 565127326 3390289109>
21:59:32.078925 IP 192.168.1.200.51948 > 209.211.201.105.http: S 99135475:99135475(0) win 65535 <mss 1460,nop,wscale 1,nop,nop,timestamp 565127328 0,sackOK,eol>
21:59:32.151601 IP 209.211.201.105.http > 192.168.1.200.51948: S 829277286:829277286(0) ack 99135476 win 5792 <mss 1460,sackOK,timestamp 3264489532 565127328,nop,wscale 0>
21:59:32.151673 IP 192.168.1.200.51948 > 209.211.201.105.http: . ack 1 win 33304 <nop,nop,timestamp 565127328 3264489532>
21:59:32.152080 IP 192.168.1.200.51948 > 209.211.201.105.http: P 1:449(448) ack 1 win 33304 <nop,nop,timestamp 565127328 3264489532>
21:59:32.220582 IP 209.211.201.105.http > 192.168.1.200.51948: . ack 449 win 6432 <nop,nop,timestamp 3264489601 565127328>
21:59:32.221277 IP 209.211.201.105.http > 192.168.1.200.51948: P 1:280(279) ack 449 win 6432 <nop,nop,timestamp 3264489602 565127328>
21:59:32.221314 IP 192.168.1.200.51948 > 209.211.201.105.http: . ack 280 win 33164 <nop,nop,timestamp 565127329 3264489602>
21:59:32.221756 IP 192.168.1.200.51948 > 209.211.201.105.http: F 449:449(0) ack 280 win 33304 <nop,nop,timestamp 565127329 3264489602>
21:59:32.232580 IP 192.168.1.200.51949 > 209.211.201.105.http: S 3192695334:3192695334(0) win 65535 <mss 1460,nop,wscale 1,nop,nop,timestamp 565127329 0,sackOK,eol>
21:59:32.293680 IP 209.211.201.105.http > 192.168.1.200.51948: F 280:280(0) ack 450 win 6432 <nop,nop,timestamp 3264489671 565127329>
21:59:32.301015 IP 209.211.201.105.http > 192.168.1.200.51949: S 829302956:829302956(0) ack 3192695335 win 5792 <mss 1460,sackOK,timestamp 3264489683 565127329,nop,wscale 0>
21:59:32.301095 IP 192.168.1.200.51949 > 209.211.201.105.http: . ack 1 win 33304 <nop,nop,timestamp 565127330 3264489683>
21:59:32.302041 IP 192.168.1.200.51949 > 209.211.201.105.http: P 1:440(439) ack 1 win 33304 <nop,nop,timestamp 565127330 3264489683>
21:59:32.306096 IP 17.112.152.32.http > 192.168.1.200.51947: F 158:158(0) ack 1920 win 8190
21:59:32.306130 IP 192.168.1.200.51947 > 17.112.152.32.http: . ack 159 win 65535
21:59:32.371703 IP 209.211.201.105.http > 192.168.1.200.51949: . ack 440 win 6432 <nop,nop,timestamp 3264489753 565127330>
21:59:32.372883 IP 209.211.201.105.http > 192.168.1.200.51949: P 1:278(277) ack 440 win 6432 <nop,nop,timestamp 3264489754 565127330>
21:59:32.372925 IP 192.168.1.200.51949 > 209.211.201.105.http: . ack 278 win 33165 <nop,nop,timestamp 565127331 3264489754>
21:59:32.373354 IP 192.168.1.200.51949 > 209.211.201.105.http: F 440:440(0) ack 278 win 33304 <nop,nop,timestamp 565127331 3264489754>
21:59:32.384125 IP 192.168.1.200.51950 > 209.211.201.105.http: S 2684504316:2684504316(0) win 65535 <mss 1460,nop,wscale 1,nop,nop,timestamp 565127331 0,sackOK,eol>
21:59:32.443039 IP 209.211.201.105.http > 192.168.1.200.51949: F 278:278(0) ack 441 win 6432 <nop,nop,timestamp 3264489823 565127331>
21:59:32.455907 IP 209.211.201.105.http > 192.168.1.200.51950: S 824850554:824850554(0) ack 2684504317 win 5792 <mss 1460,sackOK,timestamp 3264489835 565127331,nop,wscale 0>
21:59:32.455956 IP 192.168.1.200.51950 > 209.211.201.105.http: . ack 1 win 33304 <nop,nop,timestamp 565127331 3264489835>
21:59:32.456330 IP 192.168.1.200.51950 > 209.211.201.105.http: P 1:449(448) ack 1 win 33304 <nop,nop,timestamp 565127331 3264489835>
21:59:32.527991 IP 209.211.201.105.http > 192.168.1.200.51950: . ack 449 win 6432 <nop,nop,timestamp 3264489909 565127331>
21:59:32.529371 IP 209.211.201.105.http > 192.168.1.200.51950: P 1:279(278) ack 449 win 6432 <nop,nop,timestamp 3264489910 565127331>
21:59:32.529415 IP 192.168.1.200.51950 > 209.211.201.105.http: . ack 279 win 33165 <nop,nop,timestamp 565127332 3264489910>
21:59:32.529909 IP 192.168.1.200.51950 > 209.211.201.105.http: F 449:449(0) ack 279 win 33304 <nop,nop,timestamp 565127332 3264489910>
21:59:32.536771 IP 192.168.1.200.51951 > 209.211.201.105.http: S 136721915:136721915(0) win 65535 <mss 1460,nop,wscale 1,nop,nop,timestamp 565127332 0,sackOK,eol>
21:59:32.599903 IP 209.211.201.105.http > 192.168.1.200.51950: F 279:279(0) ack 450 win 6432 <nop,nop,timestamp 3264489979 565127332>
21:59:32.605147 IP 209.211.201.105.http > 192.168.1.200.51951: S 828830820:828830820(0) ack 136721916 win 5792 <mss 1460,sackOK,timestamp 3264489987 565127332,nop,wscale 0>
21:59:32.605190 IP 192.168.1.200.51951 > 209.211.201.105.http: . ack 1 win 33304 <nop,nop,timestamp 565127333 3264489987>
21:59:32.605474 IP 192.168.1.200.51951 > 209.211.201.105.http: P 1:442(441) ack 1 win 33304 <nop,nop,timestamp 565127333 3264489987>
21:59:32.679234 IP 209.211.201.105.http > 192.168.1.200.51951: . ack 442 win 6432 <nop,nop,timestamp 3264490059 565127333>
21:59:32.679450 IP 209.211.201.105.http > 192.168.1.200.51951: P 1:281(280) ack 442 win 6432 <nop,nop,timestamp 3264490060 565127333>
21:59:32.679487 IP 192.168.1.200.51951 > 209.211.201.105.http: . ack 281 win 33164 <nop,nop,timestamp 565127334 3264490060>
21:59:32.679937 IP 192.168.1.200.51951 > 209.211.201.105.http: F 442:442(0) ack 281 win 33304 <nop,nop,timestamp 565127334 3264490060>
21:59:32.709325 IP 192.168.1.200.51952 > 209.211.201.105.http: S 2973207517:2973207517(0) win 65535 <mss 1460,nop,wscale 1,nop,nop,timestamp 565127334 0,sackOK,eol>
21:59:32.710809 IP 192.168.1.200.51953 > 209.211.201.105.http: S 457323321:457323321(0) win 65535 <mss 1460,nop,wscale 1,nop,nop,timestamp 565127334 0,sackOK,eol>
21:59:32.719829 IP 192.168.1.200.51595 > 192.168.1.1.domain: 36623+ A? pix01.revsci.net. (34)
21:59:32.720111 IP 192.168.1.200.51596 > 192.168.1.1.domain: 15621+ AAAA? pix01.revsci.net. (34)
21:59:32.742280 IP 192.168.1.1.domain > 192.168.1.200.51595: 36623 2/0/0 CNAME[|domain]
21:59:32.747606 IP 209.211.201.105.http > 192.168.1.200.51951: F 281:281(0) ack 443 win 6432 <nop,nop,timestamp 3264490129 565127334>
21:59:32.778607 IP 209.211.201.105.http > 192.168.1.200.51952: S 824169450:824169450(0) ack 2973207518 win 5792 <mss 1460,sackOK,timestamp 3264490159 565127334,nop,wscale 0>
21:59:32.778649 IP 192.168.1.200.51952 > 209.211.201.105.http: . ack 1 win 33304 <nop,nop,timestamp 565127335 3264490159>
21:59:32.779027 IP 192.168.1.200.51952 > 209.211.201.105.http: P 1:458(457) ack 1 win 33304 <nop,nop,timestamp 565127335 3264490159>
21:59:32.781143 IP 209.211.201.105.http > 192.168.1.200.51953: S 828165604:828165604(0) ack 457323322 win 5792 <mss 1460,sackOK,timestamp 3264490163 565127334,nop,wscale 0>
21:59:32.781177 IP 192.168.1.200.51953 > 209.211.201.105.http: . ack 1 win 33304 <nop,nop,timestamp 565127335 3264490163>
21:59:32.781474 IP 192.168.1.200.51953 > 209.211.201.105.http: P 1:440(439) ack 1 win 33304 <nop,nop,timestamp 565127335 3264490163>
21:59:32.802952 IP 192.168.1.200.51954 > 206.191.161.8.http: S 2824533494:2824533494(0) win 65535 <mss 1460,nop,wscale 1,nop,nop,timestamp 565127335 0,sackOK,eol>
21:59:32.835568 IP 192.168.1.1.domain > 192.168.1.200.51596: 15621 1/0/0 CNAME[|domain]
21:59:32.835608 IP 192.168.1.200 > 192.168.1.1: ICMP 192.168.1.200 udp port 51596 unreachable, length 36
21:59:32.841445 IP 206.191.161.8.http > 192.168.1.200.51954: S 1032645805:1032645805(0) ack 2824533495 win 5792 <mss 1460,sackOK,timestamp 2717397737 565127335,nop,wscale 2>
21:59:32.841511 IP 192.168.1.200.51954 > 206.191.161.8.http: . ack 1 win 33304 <nop,nop,timestamp 565127335 2717397737>
21:59:32.843234 IP 192.168.1.200.51954 > 206.191.161.8.http: P 1:814(813) ack 1 win 33304 <nop,nop,timestamp 565127335 2717397737>
21:59:32.847942 IP 209.211.201.105.http > 192.168.1.200.51952: . ack 458 win 6432 <nop,nop,timestamp 3264490230 565127335>
21:59:32.849663 IP 209.211.201.105.http > 192.168.1.200.51952: P 1:273(272) ack 458 win 6432 <nop,nop,timestamp 3264490230 565127335>
21:59:32.849694 IP 192.168.1.200.51952 > 209.211.201.105.http: . ack 273 win 33168 <nop,nop,timestamp 565127335 3264490230>
21:59:32.850180 IP 192.168.1.200.51952 > 209.211.201.105.http: F 458:458(0) ack 273 win 33304 <nop,nop,timestamp 565127335 3264490230>
21:59:32.853627 IP 209.211.201.105.http > 192.168.1.200.51953: . ack 440 win 6432 <nop,nop,timestamp 3264490234 565127335>
21:59:32.853843 IP 209.211.201.105.http > 192.168.1.200.51953: P 1:280(279) ack 440 win 6432 <nop,nop,timestamp 3264490234 565127335>
21:59:32.853967 IP 192.168.1.200.51953 > 209.211.201.105.http: . ack 280 win 33164 <nop,nop,timestamp 565127335 3264490234>
21:59:32.854912 IP 192.168.1.200.51953 > 209.211.201.105.http: F 440:440(0) ack 280 win 33304 <nop,nop,timestamp 565127335 3264490234>
21:59:32.871628 IP 192.168.1.200.51955 > 209.211.201.105.http: S 3375925072:3375925072(0) win 65535 <mss 1460,nop,wscale 1,nop,nop,timestamp 565127336 0,sackOK,eol>
21:59:32.887171 IP 206.191.161.8.http > 192.168.1.200.51954: . ack 814 win 1855 <nop,nop,timestamp 2717397782 565127335>
21:59:32.894903 IP 206.191.161.8.http > 192.168.1.200.51954: P 1:587(586) ack 814 win 1855 <nop,nop,timestamp 2717397789 565127335>
21:59:32.894952 IP 192.168.1.200.51954 > 206.191.161.8.http: . ack 587 win 33011 <nop,nop,timestamp 565127336 2717397789>
21:59:32.895325 IP 206.191.161.8.http > 192.168.1.200.51954: F 587:587(0) ack 814 win 1855 <nop,nop,timestamp 2717397789 565127335>
21:59:32.895355 IP 192.168.1.200.51954 > 206.191.161.8.http: . ack 588 win 33304 <nop,nop,timestamp 565127336 2717397789>
21:59:32.895650 IP 192.168.1.200.51954 > 206.191.161.8.http: F 814:814(0) ack 588 win 33304 <nop,nop,timestamp 565127336 2717397789>
21:59:32.925249 IP 209.211.201.105.http > 192.168.1.200.51952: F 273:273(0) ack 459 win 6432 <nop,nop,timestamp 3264490304 565127335>
21:59:32.925859 IP 209.211.201.105.http > 192.168.1.200.51953: F 280:280(0) ack 441 win 6432 <nop,nop,timestamp 3264490307 565127335>
21:59:32.936372 IP 206.191.161.8.http > 192.168.1.200.51954: . ack 815 win 1855 <nop,nop,timestamp 2717397831 565127336>
21:59:32.939753 IP 209.211.201.105.http > 192.168.1.200.51955: S 830988202:830988202(0) ack 3375925073 win 5792 <mss 1460,sackOK,timestamp 3264490321 565127336,nop,wscale 0>
21:59:32.939801 IP 192.168.1.200.51955 > 209.211.201.105.http: . ack 1 win 33304 <nop,nop,timestamp 565127336 3264490321>
21:59:32.940177 IP 192.168.1.200.51955 > 209.211.201.105.http: P 1:442(441) ack 1 win 33304 <nop,nop,timestamp 565127336 3264490321>
21:59:33.011503 IP 209.211.201.105.http > 192.168.1.200.51955: . ack 442 win 6432 <nop,nop,timestamp 3264490394 565127336>
21:59:33.013476 IP 209.211.201.105.http > 192.168.1.200.51955: P 1:279(278) ack 442 win 6432 <nop,nop,timestamp 3264490394 565127336>
21:59:33.013596 IP 192.168.1.200.51955 > 209.211.201.105.http: . ack 279 win 33165 <nop,nop,timestamp 565127337 3264490394>
21:59:33.014363 IP 192.168.1.200.51955 > 209.211.201.105.http: F 442:442(0) ack 279 win 33304 <nop,nop,timestamp 565127337 3264490394>
21:59:33.089498 IP 209.211.201.105.http > 192.168.1.200.51955: F 279:279(0) ack 443 win 6432 <nop,nop,timestamp 3264490467 565127337>
21:59:33.118093 IP 192.168.1.200.51956 > 64.14.56.77.http: S 579978815:579978815(0) win 65535 <mss 1460,nop,wscale 1,nop,nop,timestamp 565127338 0,sackOK,eol>
21:59:33.118346 IP 192.168.1.200.51957 > 64.14.56.90.http: S 2584402609:2584402609(0) win 65535 <mss 1460,nop,wscale 1,nop,nop,timestamp 565127338 0,sackOK,eol>
21:59:33.119865 IP 192.168.1.200.51597 > 192.168.1.1.domain: 46961+ AAAA? ksby.images.worldnow.com. (42)
21:59:33.120283 IP 192.168.1.200.51598 > 192.168.1.1.domain: 1499+ A? ksby.images.worldnow.com. (42)
21:59:33.122602 IP 192.168.1.1.domain > 192.168.1.200.51597: 46961 2/0/0 CNAME[|domain]
21:59:33.143283 IP 192.168.1.1.domain > 192.168.1.200.51598: 1499 4/0/0 CNAME[|domain]
21:59:33.143887 IP 192.168.1.200.51958 > 64.86.94.17.http: S 3379802221:3379802221(0) win 65535 <mss 1460,nop,wscale 1,nop,nop,timestamp 565127338 0,sackOK,eol>
21:59:33.144078 IP 192.168.1.200.51959 > 64.86.94.17.http: S 885862115:885862115(0) win 65535 <mss 1460,nop,wscale 1,nop,nop,timestamp 565127338 0,sackOK,eol>
21:59:33.144195 IP 192.168.1.200.51960 > 64.86.94.17.http: S 2160012712:2160012712(0) win 65535 <mss 1460,nop,wscale 1,nop,nop,timestamp 565127338 0,sackOK,eol>
21:59:33.144313 IP 192.168.1.200.51961 > 64.86.94.17.http: S 932125983:932125983(0) win 65535 <mss 1460,nop,wscale 1,nop,nop,timestamp 565127338 0,sackOK,eol>
21:59:33.164801 IP 64.86.94.17.http > 192.168.1.200.51958: S 831094350:831094350(0) ack 3379802222 win 5792 <mss 1460,sackOK,timestamp 2920776589 565127338,nop,wscale 0>
21:59:33.164853 IP 192.168.1.200.51958 > 64.86.94.17.http: . ack 1 win 33304 <nop,nop,timestamp 565127338 2920776589>
21:59:33.165296 IP 192.168.1.200.51958 > 64.86.94.17.http: P 1:369(368) ack 1 win 33304 <nop,nop,timestamp 565127338 2920776589>
21:59:33.165858 IP 64.86.94.17.http > 192.168.1.200.51959: S 837901513:837901513(0) ack 885862116 win 5792 <mss 1460,sackOK,timestamp 2920776589 565127338,nop,wscale 0>
21:59:33.165965 IP 192.168.1.200.51959 > 64.86.94.17.http: . ack 1 win 33304 <nop,nop,timestamp 565127338 2920776589>
21:59:33.166265 IP 64.86.94.17.http > 192.168.1.200.51960: S 823923372:823923372(0) ack 2160012713 win 5792 <mss 1460,sackOK,timestamp 2920776589 565127338,nop,wscale 0>
21:59:33.166274 IP 64.86.94.17.http > 192.168.1.200.51961: S 829149500:829149500(0) ack 932125984 win 5792 <mss 1460,sackOK,timestamp 2920776589 565127338,nop,wscale 0>
21:59:33.166304 IP 192.168.1.200.51960 > 64.86.94.17.http: . ack 1 win 33304 <nop,nop,timestamp 565127338 2920776589>
21:59:33.166325 IP 192.168.1.200.51961 > 64.86.94.17.http: . ack 1 win 33304 <nop,nop,timestamp 565127338 2920776589>
21:59:33.166496 IP 192.168.1.200.51959 > 64.86.94.17.http: P 1:430(429) ack 1 win 33304 <nop,nop,timestamp 565127338 2920776589>
21:59:33.167093 IP 192.168.1.200.51960 > 64.86.94.17.http: P 1:437(436) ack 1 win 33304 <nop,nop,timestamp 565127338 2920776589>
21:59:33.167377 IP 192.168.1.200.51961 > 64.86.94.17.http: P 1:433(432) ack 1 win 33304 <nop,nop,timestamp 565127338 2920776589>
21:59:33.173787 IP 209.211.201.105.http > 192.168.1.200.51948: F 280:280(0) ack 450 win 6432 <nop,nop,timestamp 3264490556 565127329>
21:59:33.173870 IP 192.168.1.200.51948 > 209.211.201.105.http: . ack 281 win 33304 <nop,nop,timestamp 565127339 3264490556>
21:59:33.185423 IP 64.86.94.17.http > 192.168.1.200.51958: . ack 369 win 6432 <nop,nop,timestamp 2920776609 565127338>
21:59:33.192310 IP 64.86.94.17.http > 192.168.1.200.51959: . ack 430 win 6432 <nop,nop,timestamp 2920776614 565127338>
21:59:33.192619 IP 64.86.94.17.http > 192.168.1.200.51960: . ack 437 win 6432 <nop,nop,timestamp 2920776614 565127338>
21:59:33.194739 IP 64.86.94.17.http > 192.168.1.200.51961: . ack 433 win 6432 <nop,nop,timestamp 2920776617 565127338>
21:59:33.196157 IP 64.86.94.17.http > 192.168.1.200.51958: . 1:1449(1448) ack 369 win 6432 <nop,nop,timestamp 2920776617 565127338>
21:59:33.196445 IP 64.86.94.17.http > 192.168.1.200.51958: P 1449:2730(1281) ack 369 win 6432 <nop,nop,timestamp 2920776617 565127338>
21:59:33.196476 IP 192.168.1.200.51958 > 64.86.94.17.http: . ack 2730 win 32663 <nop,nop,timestamp 565127339 2920776617>
21:59:33.198034 IP 192.168.1.200.51958 > 64.86.94.17.http: P 369:805(436) ack 2730 win 33304 <nop,nop,timestamp 565127339 2920776617>
21:59:33.219030 IP 64.14.56.77.http > 192.168.1.200.51956: S 409986403:409986403(0) ack 579978816 win 8190 <mss 1460>
21:59:33.219098 IP 192.168.1.200.51956 > 64.14.56.77.http: . ack 1 win 65535
21:59:33.219472 IP 192.168.1.200.51956 > 64.14.56.77.http: P 1:891(890) ack 1 win 65535
21:59:33.222235 IP 64.14.56.90.http > 192.168.1.200.51957: S 2391409897:2391409897(0) ack 2584402610 win 8190 <mss 1460>
21:59:33.222271 IP 192.168.1.200.51957 > 64.14.56.90.http: . ack 1 win 65535
21:59:33.222575 IP 192.168.1.200.51957 > 64.14.56.90.http: . 1:1461(1460) ack 1 win 65535
21:59:33.266912 IP 64.86.94.17.http > 192.168.1.200.51961: P 1:230(229) ack 433 win 6432 <nop,nop,timestamp 2920776691 565127338>
21:59:33.266976 IP 192.168.1.200.51961 > 64.86.94.17.http: . ack 230 win 33189 <nop,nop,timestamp 565127339 2920776691>
21:59:33.267274 IP 192.168.1.200.51961 > 64.86.94.17.http: P 433:801(368) ack 230 win 33304 <nop,nop,timestamp 565127339 2920776691>
21:59:33.268589 IP 64.86.94.17.http > 192.168.1.200.51960: P 1:231(230) ack 437 win 6432 <nop,nop,timestamp 2920776692 565127338>
21:59:33.268672 IP 192.168.1.200.51960 > 64.86.94.17.http: . ack 231 win 33189 <nop,nop,timestamp 565127339 2920776692>
21:59:33.268876 IP 192.168.1.200.51960 > 64.86.94.17.http: P 437:872(435) ack 231 win 33304 <nop,nop,timestamp 565127339 2920776692>
21:59:33.270074 IP 64.86.94.17.http > 192.168.1.200.51958: . ack 805 win 7504 <nop,nop,timestamp 2920776693 565127339>
21:59:33.286793 IP 64.86.94.17.http > 192.168.1.200.51961: . ack 801 win 7504 <nop,nop,timestamp 2920776711 565127339>
21:59:33.287711 IP 64.86.94.17.http > 192.168.1.200.51961: . 230:1678(1448) ack 801 win 7504 <nop,nop,timestamp 2920776711 565127339>
21:59:33.288435 IP 64.86.94.17.http > 192.168.1.200.51961: P 1678:2489(811) ack 801 win 7504 <nop,nop,timestamp 2920776711 565127339>
21:59:33.288480 IP 192.168.1.200.51961 > 64.86.94.17.http: . ack 2489 win 32898 <nop,nop,timestamp 565127340 2920776711>
21:59:33.289625 IP 192.168.1.200.51961 > 64.86.94.17.http: F 801:801(0) ack 2489 win 33304 <nop,nop,timestamp 565127340 2920776711>
21:59:33.293554 IP 64.86.94.17.http > 192.168.1.200.51960: . ack 872 win 7504 <nop,nop,timestamp 2920776715 565127339>
21:59:33.319045 IP 64.86.94.17.http > 192.168.1.200.51961: F 2489:2489(0) ack 802 win 7504 <nop,nop,timestamp 2920776743 565127340>
21:59:33.327296 IP 64.14.56.77.http > 192.168.1.200.51956: P 1:1011(1010) ack 891 win 64645
21:59:33.327340 IP 192.168.1.200.51956 > 64.14.56.77.http: . ack 1011 win 64690
21:59:33.327886 IP 209.211.201.105.http > 192.168.1.200.51949: F 278:278(0) ack 441 win 6432 <nop,nop,timestamp 3264490708 565127331>
21:59:33.327918 IP 192.168.1.200.51949 > 209.211.201.105.http: . ack 279 win 33304 <nop,nop,timestamp 565127340 3264490708>
21:59:33.328183 IP 192.168.1.200.51956 > 64.14.56.77.http: F 891:891(0) ack 1011 win 65535
21:59:33.338024 IP 192.168.1.200.51962 > 64.14.56.77.http: S 3079487821:3079487821(0) win 65535 <mss 1460,nop,wscale 1,nop,nop,timestamp 565127340 0,sackOK,eol>
21:59:33.342006 IP 64.86.94.17.http > 192.168.1.200.51959: P 1:221(220) ack 430 win 6432 <nop,nop,timestamp 2920776766 565127338>
21:59:33.342043 IP 192.168.1.200.51959 > 64.86.94.17.http: . ack 221 win 33194 <nop,nop,timestamp 565127340 2920776766>
21:59:33.342310 IP 192.168.1.200.51959 > 64.86.94.17.http: P 430:863(433) ack 221 win 33304 <nop,nop,timestamp 565127340 2920776766>
21:59:33.366851 IP 64.86.94.17.http > 192.168.1.200.51959: . ack 863 win 7504 <nop,nop,timestamp 2920776791 565127340>
21:59:33.374443 IP 64.86.94.17.http > 192.168.1.200.51960: P 231:460(229) ack 872 win 7504 <nop,nop,timestamp 2920776798 565127339>
21:59:33.374497 IP 192.168.1.200.51960 > 64.86.94.17.http: . ack 460 win 33189 <nop,nop,timestamp 565127341 2920776798>
21:59:33.374951 IP 192.168.1.200.51960 > 64.86.94.17.http: F 872:872(0) ack 460 win 33304 <nop,nop,timestamp 565127341 2920776798>
21:59:33.397610 IP 64.86.94.17.http > 192.168.1.200.51960: F 460:460(0) ack 873 win 7504 <nop,nop,timestamp 2920776817 565127341>
21:59:33.426486 IP 64.86.94.17.http > 192.168.1.200.51958: P 2730:2950(220) ack 805 win 7504 <nop,nop,timestamp 2920776849 565127339>
21:59:33.426535 IP 192.168.1.200.51958 > 64.86.94.17.http: . ack 2950 win 33194 <nop,nop,timestamp 565127341 2920776849>
21:59:33.426904 IP 192.168.1.200.51958 > 64.86.94.17.http: F 805:805(0) ack 2950 win 33304 <nop,nop,timestamp 565127341 2920776849>
21:59:33.427761 IP 64.14.56.77.http > 192.168.1.200.51956: F 1011:1011(0) ack 892 win 8190
21:59:33.443045 IP 64.14.56.77.http > 192.168.1.200.51962: S 1383312705:1383312705(0) ack 3079487822 win 8190 <mss 1460>
21:59:33.443084 IP 192.168.1.200.51962 > 64.14.56.77.http: . ack 1 win 65535
21:59:33.443346 IP 192.168.1.200.51962 > 64.14.56.77.http: P 1:904(903) ack 1 win 65535
21:59:33.445732 IP 64.86.94.17.http > 192.168.1.200.51958: F 2950:2950(0) ack 806 win 7504 <nop,nop,timestamp 2920776869 565127341>
21:59:33.481861 IP 209.211.201.105.http > 192.168.1.200.51950: F 279:279(0) ack 450 win 6432 <nop,nop,timestamp 3264490864 565127332>
21:59:33.481920 IP 192.168.1.200.51950 > 209.211.201.105.http: . ack 280 win 33304 <nop,nop,timestamp 565127342 3264490864>
21:59:33.515578 IP 64.86.94.17.http > 192.168.1.200.51959: P 221:441(220) ack 863 win 7504 <nop,nop,timestamp 2920776939 565127340>
21:59:33.515619 IP 192.168.1.200.51959 > 64.86.94.17.http: . ack 441 win 33194 <nop,nop,timestamp 565127342 2920776939>
21:59:33.517043 IP 192.168.1.200.51959 > 64.86.94.17.http: F 863:863(0) ack 441 win 33304 <nop,nop,timestamp 565127342 2920776939>
21:59:33.533857 IP 64.14.56.90.http > 192.168.1.200.51957: . ack 1461 win 8190
21:59:33.533940 IP 192.168.1.200.51957 > 64.14.56.90.http: P 1461:1499(38) ack 1 win 65535
21:59:33.534621 IP 64.86.94.17.http > 192.168.1.200.51959: F 441:441(0) ack 864 win 7504 <nop,nop,timestamp 2920776959 565127342>
21:59:33.547479 IP 64.14.56.77.http > 192.168.1.200.51962: P 1:604(603) ack 904 win 64632
21:59:33.547539 IP 192.168.1.200.51962 > 64.14.56.77.http: . ack 604 win 65097
21:59:33.631689 IP 209.211.201.105.http > 192.168.1.200.51951: F 281:281(0) ack 443 win 6432 <nop,nop,timestamp 3264491014 565127334>
21:59:33.631751 IP 192.168.1.200.51951 > 209.211.201.105.http: . ack 282 win 33304 <nop,nop,timestamp 565127343 3264491014>
21:59:33.635578 IP 64.14.56.90.http > 192.168.1.200.51957: . ack 1499 win 65535
21:59:33.651673 IP 64.14.56.90.http > 192.168.1.200.51957: P 1461:2757(1296) ack 1499 win 65535
21:59:33.651707 IP 192.168.1.200.51957 > 64.14.56.90.http: . ack 1 win 65535
21:59:33.653993 IP 64.14.56.90.http > 192.168.1.200.51957: P 1:1461(1460) ack 1499 win 65535
21:59:33.654037 IP 192.168.1.200.51957 > 64.14.56.90.http: . ack 2757 win 62944
21:59:33.806805 IP 209.211.201.105.http > 192.168.1.200.51952: F 273:273(0) ack 459 win 6432 <nop,nop,timestamp 3264491189 565127335>
21:59:33.806856 IP 192.168.1.200.51952 > 209.211.201.105.http: . ack 274 win 33304 <nop,nop,timestamp 565127345 3264491189>
21:59:33.810160 IP 209.211.201.105.http > 192.168.1.200.51953: F 280:280(0) ack 441 win 6432 <nop,nop,timestamp 3264491192 565127335>
21:59:33.810218 IP 192.168.1.200.51953 > 209.211.201.105.http: . ack 281 win 33304 <nop,nop,timestamp 565127345 3264491192>
21:59:33.971423 IP 209.211.201.105.http > 192.168.1.200.51955: F 279:279(0) ack 443 win 6432 <nop,nop,timestamp 3264491352 565127337>
21:59:33.971486 IP 192.168.1.200.51955 > 209.211.201.105.http: . ack 280 win 33304 <nop,nop,timestamp 565127347 3264491352>
21:59:34.434738 IP 64.14.56.77.http > 192.168.1.200.51956: F 1011:1011(0) ack 892 win 8190
21:59:34.434818 IP 192.168.1.200.51956 > 64.14.56.77.http: . ack 1012 win 65535
21:59:34.602898 IP 64.86.94.17.http > 192.168.1.200.51961: F 2489:2489(0) ack 802 win 7504 <nop,nop,timestamp 2920778028 565127340>
21:59:34.602963 IP 192.168.1.200.51961 > 64.86.94.17.http: . ack 2490 win 33304 <nop,nop,timestamp 565127353 2920778028>
21:59:34.679271 IP 64.86.94.17.http > 192.168.1.200.51960: F 460:460(0) ack 873 win 7504 <nop,nop,timestamp 2920778104 565127341>
21:59:34.679335 IP 192.168.1.200.51960 > 64.86.94.17.http: . ack 461 win 33304 <nop,nop,timestamp 565127354 2920778104>
21:59:34.730751 IP 64.86.94.17.http > 192.168.1.200.51958: F 2950:2950(0) ack 806 win 7504 <nop,nop,timestamp 2920778155 565127341>
21:59:34.730799 IP 192.168.1.200.51958 > 64.86.94.17.http: . ack 2951 win 33304 <nop,nop,timestamp 565127354 2920778155>
21:59:34.822258 IP 64.86.94.17.http > 192.168.1.200.51959: F 441:441(0) ack 864 win 7504 <nop,nop,timestamp 2920778245 565127342>
21:59:34.822360 IP 192.168.1.200.51959 > 64.86.94.17.http: . ack 442 win 33304 <nop,nop,timestamp 565127355 2920778245>
21:59:35.991459 IP 192.168.1.200.51599 > 192.168.1.1.domain: 28426+ A? www.amazon.com. (32)
21:59:35.991937 IP 192.168.1.200.51600 > 192.168.1.1.domain: 62664+ AAAA? www.amazon.com. (32)
21:59:36.040462 IP 192.168.1.1.domain > 192.168.1.200.51600: 62664 0/0/0 (32)
21:59:36.040686 IP 192.168.1.200.51601 > 192.168.1.1.domain: 46386+ AAAA? www.amazon.com.hsd1.ca.comcast.net. (52)
21:59:36.043083 IP 192.168.1.1.domain > 192.168.1.200.51601: 46386 NXDomain* 0/0/0 (52)
21:59:36.043209 IP 192.168.1.200.51602 > 192.168.1.1.domain: 50221+ AAAA? www.amazon.com.ca.comcast.net. (47)
21:59:36.045408 IP 192.168.1.1.domain > 192.168.1.200.51602: 50221 NXDomain* 0/0/0 (47)
21:59:36.045526 IP 192.168.1.200.51603 > 192.168.1.1.domain: 39638+ AAAA? www.amazon.com.comcast.net. (44)
21:59:36.047735 IP 192.168.1.1.domain > 192.168.1.200.51599: 28426 1/0/0 A 72.21.210.11 (48)
21:59:36.103723 IP 192.168.1.1.domain > 192.168.1.200.51603: 39638 NXDomain* 0/0/0 (44)
21:59:36.104593 IP 192.168.1.200.51963 > 72.21.210.11.http: S 3141816730:3141816730(0) win 65535 <mss 1460,nop,wscale 3,nop,nop,timestamp 565127368 0,sackOK,eol>
21:59:36.215655 IP 72.21.210.11.http > 192.168.1.200.51963: S 4243051567:4243051567(0) ack 3141816731 win 8190 <mss 1460>
21:59:36.215722 IP 192.168.1.200.51963 > 72.21.210.11.http: . ack 1 win 65535
21:59:36.216132 IP 192.168.1.200.51963 > 72.21.210.11.http: P 1:684(683) ack 1 win 65535
21:59:36.367145 IP 72.21.210.11.http > 192.168.1.200.51963: . ack 684 win 12815
21:59:36.714365 IP 208.65.153.253.http > 192.168.1.200.51750: F 1:1(0) ack 0 win 8190
21:59:36.714435 IP 192.168.1.200.51750 > 208.65.153.253.http: R 2882228018:2882228018(0) win 0
21:59:37.176068 IP 72.21.210.11.http > 192.168.1.200.51963: . 1:1461(1460) ack 684 win 12815
21:59:37.177437 IP 72.21.210.11.http > 192.168.1.200.51963: . 1461:2921(1460) ack 684 win 12815
21:59:37.177493 IP 192.168.1.200.51963 > 72.21.210.11.http: . ack 2921 win 65535
